"question";"answer";"from";"source";"folder"
"Aku pikir aku sudah hebat karena proyekku laku keras, apa salah kalau aku merasa spesial?";"Kesuksesan itu memang membanggakan, tapi merasa spesial bisa bikin kita lengah. Ingat, satu keberhasilan bukan akhir perjalanan. Apa langkah selanjutnya yang bisa bikin kamu terus berkembang?";"GROK";"D9_GROK_EgoIsTheEnemy117-127_20";"idn-ocr"
"Kenapa sih aku suka membandingkan diri dengan orang lain? Aku merasa lebih baik dari mereka.";"Membandingkan diri itu wajar, tapi kalau bikin kamu merasa lebih tinggi, itu bisa menutup mata dari kekurangan sendiri. Coba lihat, apa yang bisa kamu pelajari dari orang lain, bukan cuma apa yang bikin kamu unggul.";"GROK";"D9_GROK_EgoIsTheEnemy117-127_20";"idn-ocr"
"Aku merasa aku pantas dapat pujian karena kerja kerasku, kenapa orang lain nggak ngeliat itu?";"Kerja kerasmu pasti berarti, tapi kadang orang lain nggak selalu notice. Daripada nunggu pujian, coba fokus ke apa yang bikin kamu bangga sama dirimu sendiri. Apa yang paling kamu sukai dari usahamu itu?";"GROK";"D9_GROK_EgoIsTheEnemy117-127_20";"idn-ocr"
"Aku suka pamer di medsos biar orang tahu aku sukses, apa itu salah?";"Pamer sedikit wajar, tapi kalau tujuannya cuma cari perhatian, itu bisa bikin kamu lupa tujuan aslimu. Coba pikir, apa postingan itu bikin kamu lebih baik, atau cuma bikin orang lain iri?";"GROK";"D9_GROK_EgoIsTheEnemy117-127_20";"idn-ocr"
"Aku merasa nggak perlu denger kritik karena aku udah cukup bagus, bener nggak sih?";"Merasa bagus itu boleh, tapi menutup diri dari kritik bisa bikin kamu stuck. Kritik itu kayak cermin, bantu lihat apa yang masih kurang. Apa kritik terakhir yang kamu dengar, dan apa kamu pernah pikirin beneran?";"GROK";"D9_GROK_EgoIsTheEnemy117-127_20";"idn-ocr"
"Aku selalu bilang aku bakal sukses besar, tapi kok nggak maju-maju ya?";"Bermimpi besar itu bagus, tapi cuma ngomong nggak cukup. Coba cek, apa tindakan kecil yang udah kamu lakukan hari ini buat deketin mimpimu? Mulai dari situ dulu.";"GROK";"D9_GROK_EgoIsTheEnemy117-127_20";"idn-ocr"
"Aku merasa ideku udah paling top, tapi kenapa nggak ada yang ngedukung?";"Ide bagus itu awal, tapi eksekusi yang bikin beda. Mungkin orang lain belum lihat hasilnya. Coba ceritain, apa langkah konkret yang udah kamu ambil buat wujudin ide itu?";"GROK";"D9_GROK_EgoIsTheEnemy117-127_20";"idn-ocr"
"Aku nggak suka kerja keras kalau nggak langsung kelihatan hasilnya, apa salah?";"Pengen hasil cepat itu manusiawi, tapi kerja keras itu kayak tanam benih, butuh waktu. Kalau nggak sabar, kamu bisa kehilangan sesuatu yang besar. Apa satu hal kecil yang bisa kamu lakuin hari ini buat tetap jalan?";"GROK";"D9_GROK_EgoIsTheEnemy117-127_20";"idn-ocr"
"Aku merasa aku lebih pinter dari temen-temenku, makanya aku nggak dengerin mereka.";"Merasa pinter boleh, tapi nggak dengerin orang lain bisa bikin kamu ketinggalan perspektif baru. Coba inget, pernah nggak sih temen kasih saran yang ternyata bermanfaat?";"GROK";"D9_GROK_EgoIsTheEnemy117-127_20";"idn-ocr"
"Aku suka bilang aku bakal jadi yang terbaik, tapi kok takut gagal ya?";"Ngomong besar itu bisa nyemangatin, tapi juga bikin tekanan. Gagal itu bagian dari proses, kok. Coba fokus ke satu langkah kecil yang bisa kamu lakuin sekarang, apa itu?";"GROK";"D9_GROK_EgoIsTheEnemy117-127_20";"idn-ocr"
"Aku nggak mau kerja yang nggak bikin aku terkenal, apa itu salah?";"Pengen diakui itu wajar, tapi kalau cuma kejar ketenaran, kamu bisa lupa apa yang bener-bener penting. Pekerjaan yang nggak kelihatan sering jadi fondasi sukses. Apa kerjaan kecil yang kamu hindari sekarang?";"GROK";"D9_GROK_EgoIsTheEnemy117-127_20";"idn-ocr"
"Aku merasa nggak perlu belajar lagi karena aku udah cukup tahu, bener nggak?";"Merasa tahu banyak itu kadang bikin kita berhenti tumbuh. Orang yang rendah hati selalu nyari pelajaran baru. Coba pikir, apa satu hal yang pengen kamu pelajari tapi belum kesampaian?";"GROK";"D9_GROK_EgoIsTheEnemy117-127_20";"idn-ocr"
"Aku suka ngomongin rencana besar, tapi males ngerjainnya, kenapa ya?";"Ngomongin rencana itu gampang, tapi ngerjainnya butuh komitmen. Mungkin kamu takut gagal, atau cuma suka mimpi doang. Coba mulai dari satu tindakan kecil hari ini, apa itu?";"GROK";"D9_GROK_EgoIsTheEnemy117-127_20";"idn-ocr"
"Aku merasa orang lain nggak ngerti betapa hebatnya aku, apa yang harus kulakuin?";"Fokus ke orang lain ngerti kamu itu bisa bikin capek. Daripada nunggu pengakuan, coba buktikan lewat tindakan. Apa satu hal yang bisa kamu kerjain sekarang buat nunjukin kemampuanmu?";"GROK";"D9_GROK_EgoIsTheEnemy117-127_20";"idn-ocr"
"Aku nggak suka denger orang bilang aku salah, padahal aku yakin aku bener.";"Yakin sama diri sendiri itu bagus, tapi kadang orang lain lihat sesuatu yang kita lewatin. Coba dengar dulu, apa yang mereka bilang, dan pikirin apa ada benarnya.";"GROK";"D9_GROK_EgoIsTheEnemy117-127_20";"idn-ocr"
"Aku pengen cepet sukses, makanya aku skip langkah-langkah kecil, boleh nggak?";"Pengen cepet sukses itu wajar, tapi skip langkah kecil bisa bikin fondasimu rapuh. Sukses itu kayak bangun rumah, butuh batu satu-satu. Apa langkah kecil yang bisa kamu mulai sekarang?";"GROK";"D9_GROK_EgoIsTheEnemy117-127_20";"idn-ocr"
"Aku merasa ideku nggak perlu diperbaiki, udah sempurna, apa itu buruk?";"Yakin sama ide itu bagus, tapi bilang sempurna bisa bikin kamu nggak terbuka buat perbaikan. Coba tanya, apa satu hal yang bisa bikin ide itu lebih oke lagi?";"GROK";"D9_GROK_EgoIsTheEnemy117-127_20";"idn-ocr"
"Aku suka ngeluh kalau kerjaanku nggak dihargai, apa salah?";"Ngeluh wajar, tapi kalau kebanyakan, bisa bikin kamu lupa tujuanmu. Coba pikir, apa yang bikin kamu tetap semangat kerja meskipun nggak dihargai?";"GROK";"D9_GROK_EgoIsTheEnemy117-127_20";"idn-ocr"
"Aku merasa aku nggak butuh bantuan karena aku bisa sendiri, bener nggak?";"Mandiri itu hebat, tapi nggak terima bantuan bisa bikin perjalananmu lebih susah. Coba inget, pernah nggak bantuan orang lain bikin sesuatu jadi lebih mudah buat kamu?";"GROK";"D9_GROK_EgoIsTheEnemy117-127_20";"idn-ocr"
"Aku merasa kerja keras kok nggak cukup buat sukses, apa yang salah ya?";"Kerja keras memang penting, tapi kadang kita perlu lihat apakah kita bekerja dengan cara yang tepat. Coba refleksi, apakah kamu fokus pada proses atau cuma pada hasil? Mungkin kamu bisa coba atur prioritas atau cari cara baru yang lebih efektif.";"GROK";"D9_GROK_EgoIsTheEnemy128-138_20";"idn-ocr"
"Aku sering pura-pura tahu segalanya di depan orang lain, tapi sebenarnya takut ketahuan. Gimana caranya berhenti begini?";"Wajar kok merasa takut ketahuan, tapi pura-pura terus bisa bikin capek sendiri. Coba mulai jujur sama diri sendiri dulu, lalu pelan-pelan akui kalau ada yang nggak kamu tahu. Orang justru lebih respect sama kejujuran, dan kamu bisa belajar tanpa beban.";"GROK";"D9_GROK_EgoIsTheEnemy128-138_20";"idn-ocr"
"Aku pengen sukses cepet, apa salah kalau aku ambisius banget?";"Ambisi itu bagus, tapi kalau terlalu buru-buru, kamu bisa kehilangan fokus pada langkah-langkah kecil yang penting. Sukses itu kayak perjalanan, bukan lomba lari. Coba nikmati prosesnya dan pastikan ambisimu nggak bikin kamu lupa rendah hati.";"GROK";"D9_GROK_EgoIsTheEnemy128-138_20";"idn-ocr"
"Kadang aku males banget kerja keras, apa aku cuma kurang bakat?";"Bukan soal bakat, kok. Kerja keras memang nggak selalu enak, tapi itu yang bikin kita tumbuh. Kalau lagi males, coba mulai dari langkah kecil, misalnya kerja 10 menit aja dulu. Lama-lama kamu akan ketagihan sama progressnya.";"GROK";"D9_GROK_EgoIsTheEnemy128-138_20";"idn-ocr"
"Aku suka banget dipuji, tapi kok rasanya nggak pernah cukup?";"Wajar kok suka dipuji, tapi kalau kamu terus cari validasi dari orang lain, itu bisa bikin kamu lupa nilai dirimu sendiri. Coba fokus pada apa yang kamu lakukan karena kamu percaya itu benar, bukan karena ingin dipuji.";"GROK";"D9_GROK_EgoIsTheEnemy128-138_20";"idn-ocr"
"Aku takut kalau rendah hati nanti orang nggak notice aku, gimana dong?";"Rendah hati bukan berarti nggak kelihatan, lho. Justru kalau kamu fokus pada kerjaan yang berkualitas, orang akan notice hasilmu secara alami. Coba percaya sama proses, nggak perlu buru-buru cari perhatian.";"GROK";"D9_GROK_EgoIsTheEnemy128-138_20";"idn-ocr"
"Aku merasa hasil kerjaku nggak pernah bagus, apa aku nggak cocok di bidang ini?";"Hasil yang nggak memuaskan di awal itu wajar banget. Semua orang pernah ngalamin. Coba lihat sebagai bagian dari belajar, bukan tanda kamu nggak cocok. Apa yang bisa kamu tingkatkan? Mungkin kita bisa coba cari tahu bareng.";"GROK";"D9_GROK_EgoIsTheEnemy128-138_20";"idn-ocr"
"Aku sering nunda kerjaan, apa aku cuma nggak disiplin?";"Nunda kerjaan nggak selalu soal disiplin, bisa juga karena kamu merasa kewalahan atau takut gagal. Coba pecah tugasmu jadi bagian kecil dan mulai dari yang paling gampang. Kalau masih susah, ceritain ke aku apa yang bikin kamu nunda.";"GROK";"D9_GROK_EgoIsTheEnemy128-138_20";"idn-ocr"
"Aku pengen kelihatan sukses di mata orang lain, apa salah?";"Ingin diakui itu manusiawi, tapi kalau fokusmu cuma buat kelihatan sukses, kamu bisa lupa sama tujuan aslimu. Coba tanya diri sendiri, apa yang bikin kamu bahagia kalau nggak ada orang yang lihat? Itu yang patut dikejar.";"GROK";"D9_GROK_EgoIsTheEnemy128-138_20";"idn-ocr"
"Aku merasa orang lain lebih beruntung dari aku, kenapa ya hidupku gini?";"Perasaan itu wajar, tapi membandingkan diri sama orang lain cuma bikin capek. Tiap orang punya perjalanan sendiri. Coba fokus pada apa yang bisa kamu kontrol, misalnya usaha atau cara pandangmu. Apa satu hal kecil yang bisa kamu syukuri hari ini?";"GROK";"D9_GROK_EgoIsTheEnemy128-138_20";"idn-ocr"
"Aku takut gagal kalau coba hal baru, apa aku harus main aman aja?";"Takut gagal itu normal, tapi main aman terus bisa bikin kamu nyesel nanti. Coba mulai dari langkah kecil di hal baru itu, dan ingat, gagal itu cuma cara buat belajar. Apa hal baru yang pengen kamu coba? Kita bisa rencanain bareng.";"GROK";"D9_GROK_EgoIsTheEnemy128-138_20";"idn-ocr"
"Aku merasa kerja keras nggak dihargai, buat apa capek-capek?";"Pasti frustrasi kalau merasa nggak dihargai. Tapi kerja kerasmu nggak cuma buat orang lain, itu juga investasi buat dirimu sendiri. Coba cari tahu apa yang bikin kamu tetap semangat, meski nggak ada pujian. Aku dukung kamu, kok!";"GROK";"D9_GROK_EgoIsTheEnemy128-138_20";"idn-ocr"
"Aku suka pamer di medsos biar orang kagum, apa itu salah?";"Pamer di medsos sih nggak selalu salah, tapi coba tanya diri sendiri, kenapa kamu merasa perlu bikin orang kagum? Kalau itu cuma buat validasi, mungkin kamu bisa coba cari kepuasan dari dalam diri, misalnya dengan ngerjain sesuatu yang bikin kamu bangga.";"GROK";"D9_GROK_EgoIsTheEnemy128-138_20";"idn-ocr"
"Aku merasa nggak cukup pinter buat bersaing sama orang lain, gimana caranya?";"Merasa nggak cukup itu wajar, tapi kecerdasan nggak cuma soal akademik. Kamu punya kelebihan yang mungkin belum kamu sadari. Coba fokus pada apa yang kamu suka dan pelajari itu pelan-pelan. Aku yakin kamu bisa berkembang!";"GROK";"D9_GROK_EgoIsTheEnemy128-138_20";"idn-ocr"
"Aku pengen cepet kaya, apa aku harus ambil jalan pintas?";"Jalan pintas mungkin kelihatan menggoda, tapi seringkali nggak bertahan lama dan bisa bikin stres. Coba fokus pada membangun sesuatu yang solid, meski butuh waktu. Apa tujuanmu sebenarnya? Mungkin kita bisa bikin rencana yang realistis.";"GROK";"D9_GROK_EgoIsTheEnemy128-138_20";"idn-ocr"
"Aku ngerasa ego aku bikin aku susah deket sama orang, apa yang harus aku lakuin?";"Bagus banget kamu sadar itu! Ego kadang bikin kita lupa dengerin orang lain. Coba latihan mendengarkan dengan sungguh-sungguh dan tanya pendapat orang tanpa buru-buru membela diri. Itu bisa bikin hubunganmu lebih baik.";"GROK";"D9_GROK_EgoIsTheEnemy128-138_20";"idn-ocr"
"Aku sering merasa hasil kerjaku jelek dibandingkan orang lain, apa aku harus menyerah?";"Bandingin diri sama orang lain emang bikin down, tapi itu nggak berarti kamu harus menyerah. Hasil jelek di awal itu bagian dari proses. Coba fokus pada apa yang sudah kamu capai dan apa yang bisa diperbaiki. Aku percaya kamu bisa lebih baik!";"GROK";"D9_GROK_EgoIsTheEnemy128-138_20";"idn-ocr"
"Aku merasa nggak punya tujuan hidup, apa yang salah sama aku?";"Nggak punya tujuan hidup itu nggak berarti ada yang salah sama kamu. Banyak orang ngalamin fase ini. Coba mulai dari hal kecil yang kamu suka atau penasaran, lalu eksplor dari situ. Aku bisa bantu kamu cari tahu apa yang bikin kamu semangat.";"GROK";"D9_GROK_EgoIsTheEnemy128-138_20";"idn-ocr"
"Aku suka ngeluh kalau kerjaan susah, apa aku cuma lemah?";"Ngeluh itu wajar, kok, bukan tanda kamu lemah. Tapi kalau terlalu sering, mungkin kamu bisa coba lihat kerjaan itu dari sudut lain. Apa yang bikin susah? Mungkin kita bisa pecah jadi langkah-langkah kecil biar nggak terasa berat.";"GROK";"D9_GROK_EgoIsTheEnemy128-138_20";"idn-ocr"
"Aku pengen orang lain selalu setuju sama aku, kenapa susah banget?";"Wajar kok pengen diterima, tapi nggak mungkin semua orang setuju sama kita. Coba fokus pada apa yang kamu yakini dan dengarkan pendapat lain tanpa merasa terancam. Itu bisa bikin kamu lebih tenang dan bijak.";"GROK";"D9_GROK_EgoIsTheEnemy128-138_20";"idn-ocr"
"Aku merasa bangga banget sama pencapaianku, tapi kok malah jadi takut gagal sekarang?";"Wajar kok merasa bangga, tapi kadang rasa bangga itu bisa bikin kita terlalu fokus pada diri sendiri. Coba alihkan perhatian ke proses, bukan cuma hasil. Apa yang bisa kamu pelajari dari langkah berikutnya biar tetap berkembang?";"GROK";"D9_GROK_EgoIsTheEnemy139-149_20";"idn-ocr"
"Kenapa ya aku selalu pengen jadi pusat perhatian? Apa ini salah?";"Keinginan jadi pusat perhatian itu manusiawi, tapi kalau terlalu kuat, bisa bikin kita lupa tujuan sebenarnya. Coba tanya diri sendiri: apa yang bikin kamu merasa perlu diakui? Mungkin ada cara lain untuk merasa berharga, seperti membantu orang lain.";"GROK";"D9_GROK_EgoIsTheEnemy139-149_20";"idn-ocr"
"Aku merasa aku lebih baik dari orang lain di timku. Gimana caranya biar ga sombong?";"Punya kepercayaan diri itu bagus, tapi kalau sampai merasa lebih baik, bisa bikin hubungan sama orang lain renggang. Coba lihat kelebihan orang lain di timmu. Apa yang bisa kamu pelajari dari mereka? Itu bisa bikin kamu lebih rendah hati.";"GROK";"D9_GROK_EgoIsTheEnemy139-149_20";"idn-ocr"
"Aku baru dapat promosi, tapi kok malah stres sendiri?";"Selamat atas promosinya! Stres itu mungkin karena kamu merasa harus membuktikan sesuatu. Coba fokus pada apa yang bisa kamu lakukan hari ini, bukan ekspektasi besar. Apa satu langkah kecil yang bisa kamu ambil sekarang?";"GROK";"D9_GROK_EgoIsTheEnemy139-149_20";"idn-ocr"
"Aku pengen sukses besar, tapi takut kehilangan diri sendiri. Apa yang harus kulakukan?";"Sukses itu memang menggoda, tapi kalau kita lupa nilai-nilai kita, bisa berujung kosong. Coba pikirkan: apa yang bikin kamu merasa utuh? Pegang erat itu, biar sukses nanti tetap bermakna.";"GROK";"D9_GROK_EgoIsTheEnemy139-149_20";"idn-ocr"
"Aku sering merasa orang lain nggak ngerti betapa keras aku berusaha. Apa yang salah?";"Pasti frustrasi kalau usahamu nggak diakui. Tapi kadang, kita terlalu fokus pengen orang lain lihat. Coba alihkan energi ke tujuanmu sendiri. Apa yang bikin usahamu berarti buat dirimu, bukan orang lain?";"GROK";"D9_GROK_EgoIsTheEnemy139-149_20";"idn-ocr"
"Aku selalu merasa harus menang di setiap diskusi. Apa ini buruk?";"Keinginan menang itu bisa bikin kita lupa mendengar. Diskusi seharusnya tentang saling belajar, bukan cuma menang. Lain kali, coba dengarkan dulu sudut pandang orang lain. Apa yang bisa kamu ambil dari situ?";"GROK";"D9_GROK_EgoIsTheEnemy139-149_20";"idn-ocr"
"Aku merasa suksesku sekarang karena keberuntungan. Apa aku pantas dapat ini?";"Keberuntungan memang bisa membantu, tapi jangan lupa usaha yang kamu taruh di situ. Coba lihat ke belakang: apa saja yang kamu lakukan untuk sampai di posisi ini? Itu bukti kamu layak.";"GROK";"D9_GROK_EgoIsTheEnemy139-149_20";"idn-ocr"
"Aku benci dikritik. Gimana caranya biar nggak kesal tiap dikritik?";"Kritik memang bisa bikin panas, tapi kadang ada pelajaran di dalamnya. Coba lihat kritik itu sebagai saran untuk berkembang, bukan serangan. Apa satu hal dari kritik itu yang bisa kamu pakai untuk jadi lebih baik?";"GROK";"D9_GROK_EgoIsTheEnemy139-149_20";"idn-ocr"
"Aku pengen cepet sukses, makanya aku ambil jalan pintas. Apa salah?";"Keinginan sukses cepat itu wajar, tapi jalan pintas bisa bikin fondasimu rapuh. Kalau tujuanmu kuat, coba fokus pada langkah yang solid meski lambat. Apa satu langkah kecil yang bisa kamu ambil tanpa buru-buru?";"GROK";"D9_GROK_EgoIsTheEnemy139-149_20";"idn-ocr"
"Aku merasa orang lain cemburu sama kesuksesanku. Harusnya aku apa?";"Bisa jadi itu cuma perasaanmu, atau mungkin ada dinamika di situ. Daripada fokus ke orang lain, coba lihat ke dalam: apa yang bikin kamu merasa perlu membuktikan sesuatu? Fokus pada tujuanmu sendiri dulu.";"GROK";"D9_GROK_EgoIsTheEnemy139-149_20";"idn-ocr"
"Aku merasa nggak perlu belajar lagi karena aku udah cukup sukses. Bener nggak sih?";"Sukses sekarang nggak berarti kamu tahu segalanya. Dunia terus berubah, dan belajar bikin kamu tetap relevan. Coba cari satu hal baru yang bisa kamu pelajari minggu ini. Apa itu?";"GROK";"D9_GROK_EgoIsTheEnemy139-149_20";"idn-ocr"
"Aku suka pamer pencapaianku di sosmed. Apa itu buruk?";"Berbagi pencapaian itu oke, tapi kalau terlalu sering, bisa bikin kamu bergantung pada validasi orang lain. Coba tanya: apa yang bikin kamu merasa perlu pamer? Mungkin ada cara lain untuk merasa bangga.";"GROK";"D9_GROK_EgoIsTheEnemy139-149_20";"idn-ocr"
"Aku merasa nggak ada yang bisa ngalahin aku di pekerjaanku. Ini bahaya nggak?";"Keyakinan diri itu penting, tapi kalau sampai merasa tak tersaingi, kamu bisa lengah. Coba cari tantangan baru atau orang yang bisa menginspirasimu. Apa yang bisa bikin kamu terus berkembang?";"GROK";"D9_GROK_EgoIsTheEnemy139-149_20";"idn-ocr"
"Aku sering ngerasa orang lain nggak seberharga aku. Gimana caranya biar nggak gitu?";"Perasaan itu bisa muncul kalau kita terlalu fokus pada diri sendiri. Coba luangkan waktu untuk mengenal orang lain lebih dalam. Apa satu hal yang kamu kagumi dari seseorang di sekitarmu?";"GROK";"D9_GROK_EgoIsTheEnemy139-149_20";"idn-ocr"
"Aku pengen orang lain takut sama aku biar dihormati. Apa ini salah?";"Menghormati karena takut biasanya nggak tahan lama dan bikin hubungan nggak sehat. Coba bangun respek dengan kebaikan atau kerja keras. Apa satu tindakan yang bisa bikin orang lain menghargaimu secara tulus?";"GROK";"D9_GROK_EgoIsTheEnemy139-149_20";"idn-ocr"
"Aku merasa kesuksesanku bikin aku berhak atas semuanya. Ini wajar nggak?";"Sukses bisa bikin kita merasa berhak, tapi itu bisa bikin kita lupa bersyukur. Coba pikir: apa yang bikin kamu tetap rendah hati meski sukses? Itu bisa bantu jaga keseimbangan.";"GROK";"D9_GROK_EgoIsTheEnemy139-149_20";"idn-ocr"
"Aku sering ngerasa nggak cukup meski udah sukses. Kenapa ya?";"Kadang kita terjebak membandingkan diri dengan ekspektasi atau orang lain. Coba fokus pada apa yang bikin kamu bahagia, bukan cuma sukses. Apa satu hal kecil yang bikin kamu merasa cukup hari ini?";"GROK";"D9_GROK_EgoIsTheEnemy139-149_20";"idn-ocr"
"Aku suka ngontrol semua kerjaan timku. Apa ini salah?";"Kontrol berlebihan bisa bikin orang lain merasa nggak dipercaya. Coba beri ruang buat timmu berkontribusi. Apa satu tugas yang bisa kamu delegasikan untuk coba percayakan ke orang lain?";"GROK";"D9_GROK_EgoIsTheEnemy139-149_20";"idn-ocr"
"Aku merasa nggak apa-apa bohong demi sukses. Bener nggak sih?";"Bohong mungkin kasih hasil cepat, tapi bisa merusak kepercayaan dan dirimu sendiri. Sukses yang tahan lama butuh integritas. Coba pikir: apa cara jujur yang bisa kamu ambil untuk capai tujuanmu?";"GROK";"D9_GROK_EgoIsTheEnemy139-149_20";"idn-ocr"
"Aku merasa susah banget untuk terus belajar hal baru. Kayaknya aku udah cukup tahu banyak. Gimana caranya supaya aku tetap semangat belajar?";"Wajar kok kadang merasa kayak udah cukup tahu, tapi justru di situlah tantangannya. Coba lihat belajar sebagai petualangan, bukan beban. Mulai dari hal kecil yang bikin kamu penasaran, misalnya baca artikel pendek atau tonton video tentang topik baru. Ingat, setiap langkah kecil itu bikin kamu tumbuh. Apa sih satu hal yang pengen kamu pelajari tapi belum sempat?";"GROK";"D9_GROK_EgoIsTheEnemy150-160_20";"idn-ocr"
"Aku sering merasa aku lebih pintar dari orang lain. Tapi kadang aku stuck dan ga bisa selesain masalah. Apa yang salah?";"Wah, percaya diri itu bagus, tapi kadang kita perlu buka pikiran buat belajar dari orang lain. Mungkin coba dengar perspektif orang di sekitarmu, siapa tahu ada sudut pandang baru. Kalau merasa stuck, coba tanya ke orang yang beda pengalaman sama kamu. Siapa yang biasanya bikin kamu terinspirasi?";"GROK";"D9_GROK_EgoIsTheEnemy150-160_20";"idn-ocr"
"Aku takut gagal kalau coba hal baru. Makanya aku suka stay di zona nyaman. Gimana caranya berubah?";"Takut gagal itu manusiawi banget. Tapi coba pikir, setiap kali kamu coba sesuatu yang baru, kamu udah menang karena berani melangkah. Mulai dari langkah kecil aja, misalnya coba hobi baru seminggu sekali. Gagal bukan akhir, tapi cara buat belajar. Apa satu hal kecil yang pengen kamu coba tapi takut?";"GROK";"D9_GROK_EgoIsTheEnemy150-160_20";"idn-ocr"
"Aku suka banget ceritain keberhasilan aku ke orang lain. Tapi kok kadang aku merasa kosong setelahnya?";"Wah, bangga sama pencapaian itu oke, tapi kalau terlalu fokus ceritain ke orang lain, kadang kita lupa nikmatin prosesnya. Coba refleksi, apa sih yang bikin kamu bahagia dari keberhasilan itu? Mungkin luangkan waktu buat syukuri perjalananmu sendiri, tanpa perlu validasi orang lain. Apa momen kecil yang bikin kamu bangga akhir-akhir ini?";"GROK";"D9_GROK_EgoIsTheEnemy150-160_20";"idn-ocr"
"Aku merasa aku harus selalu kelihatan sempurna di depan orang lain. Capek banget. Gimana caranya lepas dari itu?";"Pasti melelahkan ya kalau selalu harus kelihatan sempurna. Coba ingat, orang-orang yang dekat sama kamu biasanya suka sama kamu apa adanya. Mulai dari hal kecil, misalnya ceritain satu kekuranganmu ke temen dekat. Kamu akan kaget betapa lega rasanya. Apa yang biasanya bikin kamu pengen kelihatan sempurna?";"GROK";"D9_GROK_EgoIsTheEnemy150-160_20";"idn-ocr"
"Aku susah nerima kritik. Rasanya kayak diserang. Gimana caranya biar ga gitu?";"Kritik emang kadang bikin defensif, tapi coba lihat sebagai hadiah buat bikin kamu lebih baik. Lain kali dapat kritik, tarik napas dulu, lalu tanya ke diri sendiri, ‘Apa yang bisa aku pelajari dari ini?’. Gak semua kritik bener, tapi dengar dulu, saring, dan ambil yang bermanfaat. Apa kritik yang bikin kamu kesal baru-baru ini?";"GROK";"D9_GROK_EgoIsTheEnemy150-160_20";"idn-ocr"
"Aku pengen jadi pemimpin di timku, tapi aku takut ga bisa ngatur orang. Apa yang harus aku lakuin?";"Jadi pemimpin itu gak harus tahu segalanya, kok. Mulai dari dengerin timmu dan belajar dari mereka. Coba fokus pada hal kecil, seperti kasih arahan yang jelas atau tanya pendapat mereka. Pemimpin yang baik itu yang mau belajar bareng tim. Apa yang bikin kamu takut gagal jadi pemimpin?";"GROK";"D9_GROK_EgoIsTheEnemy150-160_20";"idn-ocr"
"Aku sering ngerasa apa yang aku lakuin ga cukup dibandingkan orang lain. Gimana caranya biar ga terus membandingkan diri?";"Membandingkan diri itu kayak lari di treadmill, capek tapi ga kemana-mana. Coba fokus ke perjalananmu sendiri. Tulis tiga hal yang kamu syukuri dari usahamu minggu ini. Setiap orang punya jalur sendiri, dan kamu juga punya keunikan. Apa satu pencapaian kecil yang bikin kamu bangga?";"GROK";"D9_GROK_EgoIsTheEnemy150-160_20";"idn-ocr"
"Aku pengen coba bisnis, tapi takut ga berhasil kayak cerita sukses orang lain. Apa yang harus aku lakuin?";"Cerita sukses orang lain emang kelihatan keren, tapi mereka juga pasti punya perjuangan yang ga kelihatan. Mulai dari langkah kecil, misalnya riset pasar atau bikin rencana sederhana. Fokus ke proses, bukan hasil akhir dulu. Apa ide bisnis yang lagi ada di pikiranmu?";"GROK";"D9_GROK_EgoIsTheEnemy150-160_20";"idn-ocr"
"Aku merasa aku udah gagal total di hidup ini. Ga ada harapan. Apa yang bisa aku lakuin?";"Rasanya berat banget ya, tapi gagal bukan akhir dari segalanya. Coba ambil waktu buat istirahat dulu, lalu tulis satu hal kecil yang masih bisa kamu lakuin besok, misalnya jalan kaki atau hubungi temen. Langkah kecil itu bisa bawa harapan baru. Apa satu hal yang pernah bikin kamu merasa hidup?";"GROK";"D9_GROK_EgoIsTheEnemy150-160_20";"idn-ocr"
"Aku suka nunda-nunda kerjaan karena takut ga bagus. Gimana caranya biar ga gitu?";"Nunda kerjaan karena takut ga sempurna itu wajar, tapi coba ubah mindset: mending selesai daripada sempurna. Mulai dari bagian kecil, misalnya kerjain 10 menit aja. Setelah mulai, biasanya lebih gampang lanjut. Apa tugas yang lagi bikin kamu takut mulai?";"GROK";"D9_GROK_EgoIsTheEnemy150-160_20";"idn-ocr"
"Aku pengen belajar dari kesalahan, tapi kok malah takut buat coba lagi. Gimana caranya?";"Kesalahan itu guru terbaik, tapi emang bikin takut buat coba lagi. Coba tulis apa yang kamu pelajari dari kesalahan itu, lalu buat rencana kecil buat coba lagi dengan cara yang beda. Ingat, gagal itu cuma langkah menuju sukses. Apa satu kesalahan yang pengen kamu perbaiki?";"GROK";"D9_GROK_EgoIsTheEnemy150-160_20";"idn-ocr"
"Aku merasa ga punya bakat apa-apa dibandingkan temen-temenku. Apa yang salah sama aku?";"Setiap orang punya keunikan, kok, meskipun kadang ga langsung kelihatan. Coba pikir, apa yang kamu suka lakuin, meskipun kecil? Mulai kembangkan dari situ. Gak perlu bandingin diri sama orang lain, fokus ke versi terbaik dirimu. Apa satu hal yang kamu enjoy lakuin?";"GROK";"D9_GROK_EgoIsTheEnemy150-160_20";"idn-ocr"
