"question";"answer";"from";"source";"folder"
"Aku susah percaya sama orang lain kalau aku nggak bisa mengendalikan mereka. Apa yang salah denganku?";"Nggak ada yang salah denganmu, kok. Susah percaya itu wajar, apalagi kalau kamu merasa harus mengendalikan situasi biar aman. Tapi, coba pikir, mempercayai orang lain itu tugasmu, sedangkan cara mereka bersikap adalah tugas mereka. Kalau kamu tarik batasan dan fokus pada apa yang bisa kamu kendalikan, seperti sikapmu sendiri, perlahan kamu bisa belajar percaya tanpa merasa harus mengatur semuanya.";"GROK";"D6_GROK_BeraniTidakDisukaiW163-173_13";"idn-ocr"
"Aku merasa orang tua nggak setuju sama pilihan karirku. Harusnya aku nurut nggak?";"Aku tahu rasanya bikin sedih kalau orang tua nggak setuju. Tapi, coba pikir, karir yang kamu pilih ini bakal kamu jalani, bukan mereka. Jadi, ini tugasmu untuk memutuskan. Kamu bisa dengerin saran mereka karena mereka peduli, tapi akhirnya, pilih yang sesuai sama nilai dan mimpimu. Coba ajak mereka ngobrol terbuka, jelasin kenapa ini penting buatmu, biar mereka ngerti sudut pandangmu.";"GROK";"D6_GROK_BeraniTidakDisukaiW163-173_13";"idn-ocr"
"Kalau aku nggak ikut campur, apa nggak berarti aku nggak peduli sama orang lain?";"Nggak sama sekali! Justru dengan nggak ikut campur, kamu nunjukin bahwa kamu peduli tapi juga menghormati mereka sebagai individu. Kamu bisa dukung mereka dengan cara lain, seperti mendengarkan, memberi saran kalau diminta, atau sekadar bilang, ‘Aku di sini buatmu.’ Itu bentuk peduli yang bikin orang merasa dihargai tanpa merasa dikendalikan.";"GROK";"D6_GROK_BeraniTidakDisukaiW163-173_13";"idn-ocr"
"Aku merasa hidupku nggak akan bahagia kalau orang lain nggak setuju sama pilihanku. Gimana caranya biar nggak gitu?";"Aku paham, rasanya berat kalau merasa harus disetujui semua orang. Tapi, coba tanyain diri sendiri, ‘Siapa yang menjalani hidup ini?’ Kamu, kan? Jadi, tugasmu adalah membuat pilihan yang bikin kamu bahagia, bukan menyenangkan semua orang. Mulai kecil, seperti memilih sesuatu yang kamu suka tanpa memikirkan opini orang lain, dan lihat betapa ringannya rasanya. Aku yakin kamu bisa!";"GROK";"D6_GROK_BeraniTidakDisukaiW163-173_13";"idn-ocr"
"Apakah dunia ini benar-benar sederhana seperti yang dikatakan?";"Ya, dunia ini sangat sederhana, begitu juga dengan kehidupan. Namun, bukan dunia yang rumit, melainkan kita yang membuatnya rumit dengan cara kita memandangnya secara subjektif.";"GROK";"D6_GROK_BeraniTidakDisukaiW17-30_25";"idn-ocr"
"Mengapa seseorang merasa dunia ini penuh dengan kontradiksi dan rumit?";"Karena kita hidup di dunia yang kita maknai secara subjektif. Setiap orang melihat dunia berdasarkan pengalaman dan persepsi mereka sendiri, sehingga dunia tampak rumit.";"GROK";"D6_GROK_BeraniTidakDisukaiW17-30_25";"idn-ocr"
"Apakah semua persoalan dalam hidup juga sederhana?";"Ya, semua persoalan dalam hidup pada dasarnya sederhana, meskipun sering kali kita yang membuatnya tampak rumit karena cara kita memandang dan menanggapinya.";"GROK";"D6_GROK_BeraniTidakDisukaiW17-30_25";"idn-ocr"
"Mengapa anak-anak melihat dunia sebagai tempat yang sederhana?";"Anak-anak melihat dunia sebagai tempat yang sederhana karena mereka belum dibebani oleh tanggung jawab seperti orang dewasa, dilindungi oleh orang tua, dan belum terpapar oleh realitas sosial yang kompleks seperti diskriminasi atau ketidaksetaraan.";"GROK";"D6_GROK_BeraniTidakDisukaiW17-30_25";"idn-ocr"
"Apa yang terjadi pada pandangan anak-anak tentang dunia saat mereka dewasa?";"Saat dewasa, mereka akan menghadapi hubungan yang rumit, tanggung jawab, dan realitas sosial seperti diskriminasi dan ketidaksetaraan, sehingga pandangan mereka berubah dan dunia tampak penuh dengan kemustahilan.";"GROK";"D6_GROK_BeraniTidakDisukaiW17-30_25";"idn-ocr"
"Bagaimana seseorang bisa tetap melihat dunia sebagai tempat yang sederhana di tengah realitas yang kompleks?";"Dengan menyadari bahwa dunia yang kita lihat adalah hasil dari persepsi subjektif kita. Dengan mengubah cara kita memandang dunia, kita bisa melihatnya sebagai tempat yang lebih sederhana.";"GROK";"D6_GROK_BeraniTidakDisukaiW17-30_25";"idn-ocr"
"Apa yang membuat seseorang merasa hidup ini rumit?";"Hidup terasa rumit karena kita terjebak dalam hubungan yang kompleks, tanggung jawab sosial, dan kesadaran akan masalah seperti perang atau ketidaksetaraan, yang membuat kita kehilangan kesederhanaan dalam pandangan kita.";"GROK";"D6_GROK_BeraniTidakDisukaiW17-30_25";"idn-ocr"
"Apakah mungkin untuk mengubah cara pandang terhadap dunia?";"Ya, sangat mungkin. Dengan kesadaran bahwa dunia adalah cerminan dari persepsi subjektif kita, kita bisa memilih untuk melihat dunia dengan cara yang lebih sederhana dan positif.";"GROK";"D6_GROK_BeraniTidakDisukaiW17-30_25";"idn-ocr"
"Mengapa seseorang merasa sulit untuk percaya bahwa dunia ini sederhana?";"Karena mereka sudah terbiasa melihat dunia melalui lensa pengalaman pribadi, tanggung jawab, dan masalah sosial yang kompleks, sehingga sulit menerima pandangan yang lebih sederhana.";"GROK";"D6_GROK_BeraniTidakDisukaiW17-30_25";"idn-ocr"
"Apa hubungan antara persepsi subjektif dan kerumitan dunia?";"Persepsi subjektif membuat kita memaknai dunia berdasarkan pengalaman dan emosi kita. Jika kita melihat dunia dengan rasa takut atau cemas, dunia akan tampak rumit. Sebaliknya, jika kita melihat dengan optimisme, dunia akan terasa sederhana.";"GROK";"D6_GROK_BeraniTidakDisukaiW17-30_25";"idn-ocr"
"Bagaimana cara seseorang bisa mulai melihat dunia dengan lebih sederhana?";"Dengan melatih diri untuk fokus pada hal-hal yang benar-benar penting, melepaskan asumsi negatif, dan menerima bahwa dunia adalah apa yang kita maknai, bukan sesuatu yang objektif.";"GROK";"D6_GROK_BeraniTidakDisukaiW17-30_25";"idn-ocr"
"Apakah tanggung jawab sosial membuat hidup menjadi lebih rumit?";"Tanggung jawab sosial bisa membuat hidup terasa rumit, tetapi sebenarnya itu tergantung pada bagaimana kita memandangnya. Jika kita melihatnya sebagai beban, hidup akan terasa rumit. Jika kita melihatnya sebagai bagian dari kehidupan, kita bisa menyederhanakannya.";"GROK";"D6_GROK_BeraniTidakDisukaiW17-30_25";"idn-ocr"
"Mengapa seseorang merasa cemas dalam masyarakat modern?";"Karena masyarakat modern sering kali tidak memiliki pegangan yang jelas seperti agama di masa lalu, sehingga setiap orang hidup untuk dirinya sendiri, yang memicu rasa cemas dan bimbang.";"GROK";"D6_GROK_BeraniTidakDisukaiW17-30_25";"idn-ocr"
"Apa yang bisa dilakukan untuk mengurangi rasa cemas di dunia modern?";"Dengan memahami bahwa cemas berasal dari cara kita memandang dunia. Dengan fokus pada hal-hal yang bisa kita kontrol dan menerima ketidakpastian, kita bisa mengurangi rasa cemas.";"GROK";"D6_GROK_BeraniTidakDisukaiW17-30_25";"idn-ocr"
"Apakah dunia yang rumit adalah realitas objektif?";"Tidak, dunia yang rumit bukan realitas objektif. Dunia menjadi rumit karena cara kita memaknainya secara subjektif berdasarkan pengalaman dan persepsi kita.";"GROK";"D6_GROK_BeraniTidakDisukaiW17-30_25";"idn-ocr"
"Bagaimana seseorang bisa belajar dari pandangan orang lain tentang dunia?";"Dengan terbuka terhadap perspektif baru, mendengarkan dengan penuh perhatian, dan bersedia mempertanyakan asumsi kita sendiri tentang dunia.";"GROK";"D6_GROK_BeraniTidakDisukaiW17-30_25";"idn-ocr"
"Apa yang dimaksud dengan hidup dari sudut pandang seorang anak?";"Hidup dari sudut pandang seorang anak berarti melihat dunia dengan rasa ingin tahu, tanpa beban tanggung jawab, dan dengan optimisme bahwa segala sesuatu mungkin terjadi.";"GROK";"D6_GROK_BeraniTidakDisukaiW17-30_25";"idn-ocr"
"Mengapa seseorang kehilangan pandangan seperti anak-anak saat dewasa?";"Karena mereka mulai menghadapi realitas seperti tanggung jawab, hubungan yang rumit, dan masalah sosial, yang membuat mereka kehilangan rasa sederhana dan optimisme.";"GROK";"D6_GROK_BeraniTidakDisukaiW17-30_25";"idn-ocr"
"Apakah mungkin untuk kembali memiliki pandangan seperti anak-anak?";"Ya, dengan melatih diri untuk fokus pada hal-hal sederhana, melepaskan cinisme, dan melihat dunia dengan rasa ingin tahu dan optimisme.";"GROK";"D6_GROK_BeraniTidakDisukaiW17-30_25";"idn-ocr"
"Apa peran pengalaman pribadi dalam membentuk pandangan tentang dunia?";"Pengalaman pribadi sangat memengaruhi cara kita memandang dunia. Pengalaman positif cenderung membuat kita optimis, sementara pengalaman negatif bisa membuat kita melihat dunia sebagai tempat yang rumit.";"GROK";"D6_GROK_BeraniTidakDisukaiW17-30_25";"idn-ocr"
"Bagaimana cara seseorang mengatasi perasaan bahwa dunia penuh dengan kemustahilan?";"Dengan menyadari bahwa kemustahilan adalah hasil dari persepsi kita. Dengan mengubah cara kita memandang tantangan, kita bisa melihatnya sebagai peluang, bukan hambatan.";"GROK";"D6_GROK_BeraniTidakDisukaiW17-30_25";"idn-ocr"
"Apa yang bisa dilakukan untuk menghadapi hubungan yang rumit dengan orang lain?";"Dengan menerima bahwa hubungan yang rumit adalah bagian dari kehidupan dan fokus pada komunikasi yang jujur serta empati untuk menyederhanakan interaksi.";"GROK";"D6_GROK_BeraniTidakDisukaiW17-30_25";"idn-ocr"
"Mengapa seseorang merasa sulit untuk mengabaikan masalah sosial seperti diskriminasi?";"Karena masalah sosial seperti diskriminasi, perang, dan ketidaksetaraan sangat memengaruhi kehidupan kita dan sulit diabaikan ketika kita menjadi sadar akan dampaknya.";"GROK";"D6_GROK_BeraniTidakDisukaiW17-30_25";"idn-ocr"
"Apa yang bisa dilakukan untuk tetap tenang di tengah kesadaran akan masalah sosial?";"Dengan fokus pada hal-hal yang bisa kita kontrol, seperti tindakan kecil untuk membantu orang lain, dan menerima bahwa tidak semua masalah bisa kita selesaikan sendiri.";"GROK";"D6_GROK_BeraniTidakDisukaiW17-30_25";"idn-ocr"
"Apakah keyakinan bahwa dunia sederhana bisa membantu mengatasi rasa cemas?";"Ya, dengan mempercayai bahwa dunia pada dasarnya sederhana, kita bisa mengurangi kecemasan dengan tidak membiarkan pikiran kita terjebak dalam kerumitan yang kita ciptakan sendiri.";"GROK";"D6_GROK_BeraniTidakDisukaiW17-30_25";"idn-ocr"
"Aku sering merasa cemas karena takut orang lain nggak suka sama aku. Gimana caranya biar aku nggak terlalu memikirkan itu?";"Aku ngerti banget rasanya ingin diterima semua orang. Tapi, coba pikir, apa yang orang lain pikir tentangmu itu sebenarnya bukan sesuatu yang bisa kamu kendalikan. Fokus saja pada apa yang bisa kamu lakukan, seperti menjadi dirimu sendiri dan melakukan hal-hal yang bikin kamu bahagia. Kalau kamu nyaman dengan dirimu, orang lain juga akan lebih mudah menerimamu apa adanya.";"GROK";"D6_GROK_BeraniTidakDisukaiW174-184_12";"idn-ocr"
"Tapi kalau aku nggak peduli sama pendapat orang lain, bukannya aku jadi egois?";"Nggak egois kok. Justru dengan nggak terlalu memikirkan pendapat orang lain, kamu bisa lebih bebas untuk jadi diri sendiri dan membantu orang lain dengan tulus. Ini bukan berarti kamu cuek, tapi lebih tentang memisahkan apa yang jadi tanggung jawabmu dan apa yang bukan. Kamu nggak bisa mengatur perasaan orang lain, tapi kamu bisa mengatur caramu merespons mereka.";"GROK";"D6_GROK_BeraniTidakDisukaiW174-184_12";"idn-ocr"
"Aku punya atasan yang selalu nggak puas sama kerjaanku. Aku merasa capek banget berusaha buat diakui. Apa yang harus aku lakukan?";"Wah, itu pasti bikin frustrasi. Tapi coba lihat dari sisi lain: tugasmu adalah melakukan pekerjaan sebaik mungkin, bukan membuat atasanmu puas. Kalau dia nggak menghargai usahamu, itu bukan berarti kamu gagal. Fokus pada apa yang bisa kamu kendalikan, seperti meningkatkan keterampilanmu atau mencari cara untuk tetap termotivasi. Sikapmu yang positif akan membawa perubahan, meski nggak langsung.";"GROK";"D6_GROK_BeraniTidakDisukaiW174-184_12";"idn-ocr"
"Tapi kalau atasan nggak suka sama aku, pekerjaanku jadi susah selesai. Aku bingung harus ngapain.";"Aku paham, rasanya kayak terjebak. Tapi, kalau kamu bilang pekerjaanmu susah selesai karena atasan, itu kayak menyerahkan kendali ke dia. Coba fokus pada tugas-tugas yang bisa kamu selesaikan dengan baik, dan cari cara untuk tetap produktif meski situasinya nggak ideal. Mungkin kamu bisa bicara terbuka dengan atasan atau cari dukungan dari rekan kerja. Yang penting, jangan biarkan dia menentukan nilai dirimu.";"GROK";"D6_GROK_BeraniTidakDisukaiW174-184_12";"idn-ocr"
"Aku merasa pembagian tugas yang kamu bilang itu bikin aku nggak peduli sama orang lain. Apa bener gitu?";"Nggak, nggak gitu kok. Pembagian tugas ini justru membantu kamu membangun hubungan yang lebih sehat. Dengan tahu mana yang tugasmu dan mana yang tugas orang lain, kamu nggak akan merasa terbebani oleh ekspektasi yang nggak perlu. Kamu tetap bisa peduli, tapi tanpa harus mengorbankan dirimu sendiri. Ini tentang keseimbangan, bukan mengabaikan orang lain.";"GROK";"D6_GROK_BeraniTidakDisukaiW174-184_12";"idn-ocr"
"Aku takut kalau aku nerapin pembagian tugas, aku malah jadi jauh sama orang-orang di sekitarku. Gimana caranya biar nggak gitu?";"Keren, kamu sudah mikir ke depan! Pembagian tugas nggak bikin kamu jauh dari orang lain, kok. Justru ini bikin hubunganmu lebih jujur. Bayangin, kalau kamu terlalu dekat dan mencampuri urusan orang lain, malah bisa bikin hubungan tegang. Jaga jarak yang pas—cukup dekat untuk peduli, tapi cukup jauh supaya kalian berdua punya ruang untuk jadi diri sendiri.";"GROK";"D6_GROK_BeraniTidakDisukaiW174-184_12";"idn-ocr"
"Aku dengar tentang kisah simpul Gordian. Apa hubungannya sama masalahku yang susah ngatur hubungan sama orang lain?";"Simpul Gordian itu kayak masalah hubungan yang rumit—kalau cuma diotak-atik pake cara biasa, nggak akan selesai. Kadang, kamu perlu pendekatan baru, seperti memotong simpul itu dengan tegas. Dalam hubungan, ini artinya berani fokus pada tugasmu sendiri dan nggak terjebak pada drama yang nggak perlu. Dengan begitu, kamu bisa melihat masalah lebih jernih dan menemukan solusi yang lebih sederhana.";"GROK";"D6_GROK_BeraniTidakDisukaiW174-184_12";"idn-ocr"
"Tapi kalau aku motong simpul kayak gitu, bukannya aku bakal menyakiti orang lain atau bikin mereka menjauh?";"Aku ngerti kekhawatiranmu. Tapi motong simpul di sini bukan berarti menyakiti orang lain, melainkan membebaskan dirimu dari beban yang nggak perlu. Misalnya, kalau kamu berhenti berusaha mengubah perasaan orang lain tentangmu, kamu justru bisa lebih tulus dalam berhubungan. Orang-orang yang menghargaimu akan tetap ada, dan hubungan kalian akan lebih kuat karena kalian saling menghormati batasan masing-masing.";"GROK";"D6_GROK_BeraniTidakDisukaiW174-184_12";"idn-ocr"
"Aku merasa pembagian tugas ini terlalu dingin, kayak nggak ada emosi. Apa nggak bikin aku kehilangan koneksi sama orang lain?";"Aku tahu, awalnya mungkin terasa kaku. Tapi sebenarnya, pembagian tugas ini membantumu membangun koneksi yang lebih asli. Dengan nggak mencampuri urusan orang lain, kamu memberi mereka kebebasan untuk jadi diri mereka sendiri, dan kamu juga bebas jadi dirimu. Ini bukan tentang nggak peduli, tapi tentang menghormati. Emosi tetap ada, tapi kamu mengelolanya dengan lebih bijak.";"GROK";"D6_GROK_BeraniTidakDisukaiW174-184_12";"idn-ocr"
"Aku takut kalau aku nggak ikut campur, orang-orang yang aku sayang malah nggak merasa aku peduli. Gimana dong?";"Wajar banget khawatir gitu. Tapi peduli nggak selalu berarti harus ikut campur, lho. Kamu bisa nunjukin perhatian dengan mendengarkan, memberi dukungan, atau ada saat mereka butuh. Yang penting, biarkan mereka yang menentukan langkah mereka sendiri. Dengan begitu, mereka akan merasa dihargai, bukan dikendalikan, dan hubungan kalian akan lebih harmonis.";"GROK";"D6_GROK_BeraniTidakDisukaiW174-184_12";"idn-ocr"
"Aku merasa hidupku berantakan karena hubungan sama orang lain. Apa pembagian tugas ini beneran bisa bikin hidupku lebih sederhana?";"Pasti bisa! Bayangin, kalau kamu cuma fokus pada tugasmu sendiri—seperti menjaga kesehatan mentalmu, melakukan pekerjaanmu, atau mengejar mimpimu—dunia bakal terasa lebih ringan. Kamu nggak perlu membawa beban untuk mengatur perasaan atau tindakan orang lain. Hidup jadi lebih sederhana karena kamu cuma ngurusin yang memang jadi tanggung jawabmu.";"GROK";"D6_GROK_BeraniTidakDisukaiW174-184_12";"idn-ocr"
"Aku masih susah nerima konsep ini. Rasanya kayak nggak manusiawi. Apa aku salah mikir?";"Nggak salah kok, wajar banget merasa gitu di awal. Konsep ini memang bisa terasa asing karena kita sering diajarin buat selalu memikirkan orang lain. Tapi coba lihat, dengan pembagian tugas, kamu justru menghormati orang lain sebagai individu yang punya kendali atas hidup mereka. Ini bukan tentang jadi dingin, tapi tentang memberi kebebasan—buat mereka dan buat dirimu sendiri.";"GROK";"D6_GROK_BeraniTidakDisukaiW174-184_12";"idn-ocr"
"Aku sering merasa tertekan karena ingin semua orang menyukaiku. Apa yang bisa aku lakukan?";"Wajar kok kalau kamu ingin disukai, tapi coba pikirkan: menyenangkan semua orang itu seperti mengejar bayangan, capek dan nggak pernah selesai. Mungkin kamu bisa mulai dengan menerima dirimu apa adanya. Fokus pada apa yang bikin kamu bahagia, bukan pada apa yang orang lain pikirkan. Mau ceritain apa yang biasanya bikin kamu merasa harus disukai semua orang?";"GROK";"D6_GROK_BeraniTidakDisukaiW185-195_10";"idn-ocr"
"Kenapa aku selalu khawatir tentang apa yang orang lain pikirkan tentangku?";"Itu bisa datang dari keinginan alami untuk diterima, tapi kadang keinginan itu bikin kita lupa nilai diri sendiri. Bayangin kalau kamu nggak perlu cari pengakuan dari orang lain, tapi dari dirimu sendiri. Apa yang bikin kamu merasa berharga? Coba tulis tiga hal yang kamu suka dari dirimu, mungkin itu bisa jadi langkah awal!";"GROK";"D6_GROK_BeraniTidakDisukaiW185-195_10";"idn-ocr"
"Aku merasa hidupku nggak jelas, kayak nggak tahu apa yang sebenarnya aku mau. Gimana caranya biar lebih yakin?";"Kadang hidup memang terasa seperti kabut, ya. Tapi nggak apa-apa, itu artinya kamu sedang mencari. Coba mulai dari hal kecil: apa satu hal yang bikin kamu penasaran atau senang akhir-akhir ini? Nggak perlu jawaban besar, cukup ikuti rasa ingin tahu itu. Kalau mau, ceritain dong, apa yang lagi bikin kamu bingung soal hidupmu?";"GROK";"D6_GROK_BeraniTidakDisukaiW185-195_10";"idn-ocr"
"Aku takut banget kalau orang lain nggak suka sama aku. Ini normal nggak sih?";"Sangat normal! Hampir semua orang pernah merasa begitu. Tapi coba bayangkan, kalau kamu terus berusaha bikin semua orang suka, kamu bisa kehilangan diri sendiri. Mungkin coba tanya: apa yang bikin aku takut kalau nggak disukai? Dari situ, kita bisa cari cara buat lebih percaya diri. Apa yang biasanya bikin kamu takut kalau orang nggak suka?";"GROK";"D6_GROK_BeraniTidakDisukaiW185-195_10";"idn-ocr"
"Aku sering merasa orang lain menentukan hidupku. Gimana caranya biar aku lebih bebas?";"Rasa itu bisa muncul kalau kita terlalu fokus pada ekspektasi orang lain. Kebebasan itu dimulai dari dalam, lho. Coba tanya diri sendiri: apa yang aku mau lakukan kalau nggak ada tekanan dari siapa pun? Mulai dari langkah kecil, seperti melakukan hobi yang kamu suka tanpa peduli omongan orang. Apa hobi atau hal yang pengen kamu coba tapi takut dihakimi?";"GROK";"D6_GROK_BeraniTidakDisukaiW185-195_10";"idn-ocr"
"Kadang aku merasa hidupku cuma buat memenuhi harapan orang lain. Aku capek banget. Apa yang salah?";"Kamu nggak salah, kok. Hidup buat orang lain memang bisa bikin lelah, karena itu seperti lari tanpa tujuan yang benar-benar milikmu. Coba luangkan waktu buat kenali apa yang kamu inginkan, bukan apa yang orang lain harapkan. Misalnya, apa satu hal kecil yang bisa kamu lakukan hari ini cuma buat bikin dirimu senang?";"GROK";"D6_GROK_BeraniTidakDisukaiW185-195_10";"idn-ocr"
"Aku pengen hidup sesuai keinginanku, tapi takut dianggap egois. Gimana dong?";"Hidup sesuai keinginanmu bukan berarti egois, lho. Itu artinya kamu menghargai diri sendiri. Orang lain mungkin punya pendapat, tapi kamu nggak bisa mengontrol apa yang mereka pikirkan. Coba mulai dengan satu keputusan kecil yang bikin kamu merasa bebas, seperti memilih aktivitas yang kamu nikmati. Apa yang pengen kamu coba tapi takut dianggap egois?";"GROK";"D6_GROK_BeraniTidakDisukaiW185-195_10";"idn-ocr"
"Aku bingung, apa sih arti kebebasan itu sebenarnya?";"Kebebasan itu tentang bisa jadi dirimu sendiri tanpa terikat oleh apa yang orang lain pikirkan atau harapkan. Bukan berarti nggak peduli sama orang lain, tapi lebih tentang memilih jalan yang sesuai dengan nilai dan keinginanmu. Coba ceritain, menurutmu kebebasan itu seperti apa? Apa yang bikin kamu merasa nggak bebas sekarang?";"GROK";"D6_GROK_BeraniTidakDisukaiW185-195_10";"idn-ocr"
"Kalau aku nggak peduli sama pendapat orang lain, apa nggak jadi orang yang sombong?";"Nggak peduli pendapat orang lain bukan berarti sombong, tapi lebih tentang percaya pada dirimu sendiri. Kamu tetap bisa rendah hati sambil menjalani hidup yang sesuai dengan hatimu. Misalnya, coba pikirkan satu keputusan yang pengen kamu ambil tanpa mikirin omongan orang. Apa itu? Aku dukung kamu buat coba!";"GROK";"D6_GROK_BeraniTidakDisukaiW185-195_10";"idn-ocr"
"Aku merasa hidupku cuma buat menyenangkan orang lain. Gimana caranya berhenti dari kebiasaan ini?";"Itu langkah besar kalau kamu sudah menyadari ini! Coba mulai dengan menetapkan batasan kecil, seperti bilang 'tidak' pada sesuatu yang nggak kamu inginkan. Atau luangkan waktu buat melakukan sesuatu yang murni buat dirimu sendiri, seperti menonton film favorit atau jalan-jalan. Apa yang biasanya bikin kamu merasa harus menyenangkan orang lain?";"GROK";"D6_GROK_BeraniTidakDisukaiW185-195_10";"idn-ocr"
"Aku merasa hubunganku dengan orang tua selalu bermasalah, apa yang bisa aku lakukan?";"Hubungan dengan orang tua memang bisa rumit, tapi coba pikirkan soal pembagian tugas. Fokus pada apa yang bisa kamu kontrol, yaitu sikap dan tindakanmu sendiri. Cobalah mendekati mereka dengan niat tulus untuk memperbaiki hubungan, tanpa mengharapkan mereka berubah. Misalnya, mulai dengan percakapan kecil yang positif. Kamu punya kekuatan untuk memulai langkah pertama!";"GROK";"D6_GROK_BeraniTidakDisukaiW196-206_15";"idn-ocr"
"Kenapa aku selalu merasa takut mengingat masa kecilku yang penuh konflik?";"Wajar kalau kenangan masa kecil yang sulit bikin kamu takut. Tapi coba lihat dari sudut lain: kenangan itu seperti kartu dalam hidupmu. Kamu bisa memilih untuk tidak membiarkannya mengendalikan hubunganmu sekarang. Coba tulis apa yang kamu rasakan, lalu pikirkan satu hal kecil yang bisa kamu lakukan untuk berdamai dengan masa lalu, seperti meditasi atau ngobrol sama temen dekat.";"GROK";"D6_GROK_BeraniTidakDisukaiW196-206_15";"idn-ocr"
"Aku merasa orang lain selalu punya kendali atas hubunganku, apa aku salah?";"Kamu nggak salah merasa begitu, tapi sebenarnya kamu yang pegang kendali atas hubunganmu. Banyak orang berpikir orang lain yang menentukan, tapi kalau kamu paham pembagian tugas, kamu akan lihat bahwa sikapmu sendiri yang bikin perubahan. Coba fokus pada apa yang kamu bisa ubah, misalnya cara kamu merespons orang lain, dan lihat perbedaannya!";"GROK";"D6_GROK_BeraniTidakDisukaiW196-206_15";"idn-ocr"
"Aku ingin memperbaiki hubungan dengan keluargaku, tapi takut mereka nggak berubah, apa yang harus aku lakukan?";"Itu langkah berani yang kamu pikirkan! Ingat, kamu nggak bisa mengubah orang lain, tapi kamu bisa mengubah caramu mendekati mereka. Cobalah lakukan sesuatu dengan tulus, seperti menghabiskan waktu bersama atau sekadar mendengarkan mereka. Kalau mereka nggak berubah, itu bukan kegagalanmu. Yang penting, kamu sudah berusaha, dan itu akan bikin kamu lebih tenang.";"GROK";"D6_GROK_BeraniTidakDisukaiW196-206_15";"idn-ocr"
"Aku merasa bersalah karena nggak bisa bikin orang tuaku senang, apa aku egois?";"Nggak, kamu nggak egois. Merasa bertanggung jawab atas kebahagiaan orang lain itu wajar, tapi itu bukan tugasmu. Setiap orang punya tanggung jawab atas perasaannya sendiri. Coba fokus pada apa yang bikin kamu bahagia dan autentik, lalu bagikan kebahagiaan itu dengan mereka. Itu cara terbaik untuk menunjukkan pedulimu.";"GROK";"D6_GROK_BeraniTidakDisukaiW196-206_15";"idn-ocr"
"Aku takut kalau mencoba memperbaiki hubungan justru bikin semuanya lebih buruk, apa yang harus aku lakukan?";"Ketakutan itu normal, tapi jangan biarkan itu menghentikanmu. Mulai dari langkah kecil, seperti mengirim pesan sederhana atau bertanya kabar. Yang penting, lakukan dengan niat tulus tanpa mengharapkan hasil tertentu. Kamu nggak bisa mengontrol reaksi mereka, tapi kamu bisa mengontrol usahamu. Itu sudah cukup berarti.";"GROK";"D6_GROK_BeraniTidakDisukaiW196-206_15";"idn-ocr"
"Kenapa aku merasa hubunganku dengan orang lain selalu bergantung pada apa yang mereka pikirkan tentangku?";"Itu bisa jadi karena kamu terlalu fokus pada pandangan orang lain. Coba pikirkan: kamu punya kekuatan untuk memegang kendali atas hubunganmu. Alih-alih mencoba memenuhi harapan mereka, coba tunjukkan dirimu yang autentik. Misalnya, lakukan sesuatu yang bikin kamu bangga, dan itu akan memengaruhi hubunganmu secara positif.";"GROK";"D6_GROK_BeraniTidakDisukaiW196-206_15";"idn-ocr"
"Aku merasa kesepian kalau terlalu memisahkan tugas dalam hubungan, apa aku salah paham?";"Nggak, kamu nggak salah merasa begitu. Memisahkan tugas bukan berarti memutus hubungan, tapi lebih tentang memberi kebebasan pada diri sendiri dan orang lain. Kamu tetap bisa peduli dan terhubung, tapi tanpa beban harus mengontrol semuanya. Coba luangkan waktu untuk ngobrol sama seseorang yang kamu percaya, itu bisa bantu kurangi rasa sepi.";"GROK";"D6_GROK_BeraniTidakDisukaiW196-206_15";"idn-ocr"
"Aku ingin hubunganku dengan keluarga membaik, tapi aku nggak tahu harus mulai dari mana, ada saran?";"Langkah pertama itu selalu yang paling sulit, tapi juga paling berarti. Coba mulai dengan sesuatu yang sederhana, seperti menghubungi mereka untuk ngobrol ringan atau membantu dalam hal kecil. Yang penting, lakukan tanpa mengharapkan mereka langsung berubah. Fokus pada usahamu, dan itu akan bikin kamu merasa lebih ringan.";"GROK";"D6_GROK_BeraniTidakDisukaiW196-206_15";"idn-ocr"
