"question";"answer";"from";"source";"folder"
"Kenapa aku merasa hidup ini kayak kompetisi sama orang lain?";"Wah, perasaan kayak gitu bisa muncul kalau kita terlalu fokus sama orang lain ketimbang diri sendiri. Hidup sebenarnya nggak harus kompetisi, lho. Coba bayangin, kalau kamu fokus ke tujuanmu sendiri tanpa bandingin sama orang lain, apa yang pengen kamu capai? Aku dukung kamu, kok!";"GROK";"D6_GROK_BeraniTidakDisukaiW97-107_15";"idn-ocr"
"Aku suka banget pamer barang branded. Apa itu buruk?";"Nggak buruk, tapi mungkin kamu lagi cari cara buat merasa lebih percaya diri lewat barang-barang itu. Coba deh pikir, apa yang bikin kamu merasa bangga sama dirimu tanpa perlu barang branded? Aku yakin ada sisi keren di dirimu yang nggak perlu ditunjukkan lewat barang!";"GROK";"D6_GROK_BeraniTidakDisukaiW97-107_15";"idn-ocr"
"Aku ngerasa nggak punya apa-apa dibandingkan temenku. Gimana ngatasinnya?";"Perasaan itu pasti berat, ya. Tapi coba kita lihat dari sisi lain, mungkin kamu punya sesuatu yang temenmu nggak punya, seperti sifat atau pengalaman unik. Apa kalau kita coba buat daftar hal-hal yang kamu suka dari dirimu? Aku bisa bantu mulai, misalnya, kamu orang yang peduli, kan?";"GROK";"D6_GROK_BeraniTidakDisukaiW97-107_15";"idn-ocr"
"Aku takut orang lain nggak suka sama aku kalau aku nggak sempurna. Apa yang harus aku lakukan?";"Nggak perlu sempurna buat disukai, lho. Orang-orang yang beneran peduli sama kamu bakal suka sama kamu apa adanya. Coba fokus ke satu hubungan yang bikin kamu nyaman, lalu ceritain apa yang kamu suka dari mereka. Itu bisa bantu kamu merasa lebih terhubung!";"GROK";"D6_GROK_BeraniTidakDisukaiW97-107_15";"idn-ocr"
"Aku suka cerita tentang penderitaanku dulu. Apa itu salah?";"Nggak salah, kok. Cerita penderitaan itu bisa jadi cara kamu menunjukkan bahwa kamu kuat. Tapi kalau terlalu sering, mungkin kamu bisa coba ceritain juga hal-hal yang bikin kamu bahagia sekarang. Apa satu momen bahagia yang pengen kamu share sama aku?";"GROK";"D6_GROK_BeraniTidakDisukaiW97-107_15";"idn-ocr"
"Aku merasa orang lain lebih sukses karena pendidikan mereka. Apa aku ketinggalan?";"Nggak ketinggalan, kok! Sukses itu nggak cuma soal pendidikan, tapi soal apa yang kamu lakukan dengan apa yang kamu punya sekarang. Banyak orang sukses tanpa pendidikan tinggi karena mereka berani coba hal baru. Apa satu skill atau peluang yang pengen kamu kejar?";"GROK";"D6_GROK_BeraniTidakDisukaiW97-107_15";"idn-ocr"
"Aku merasa gagal karena tidak bisa memenuhi ekspektasi orang lain. Apa yang bisa aku lakukan?";"Kamu tidak perlu memenuhi ekspektasi semua orang, lho. Coba fokus pada apa yang benar-benar penting buat dirimu sendiri. Mengenali kapasitas dirimu adalah langkah awal untuk berdamai dengan diri sendiri. Apa sih yang menurutmu paling berarti untuk kamu capai sekarang?";"GROK";"D8_GROK_BerdamaiDenganDiriSendiri10-20_20";"idn-ocr"
"Kenapa aku selalu merasa kurang dibandingkan orang lain?";"Perasaan itu wajar, tapi coba ingat bahwa setiap orang punya keunikan masing-masing. Membandingkan diri dengan orang lain hanya bikin kamu lupa sama kelebihanmu sendiri. Apa satu hal yang kamu suka dari dirimu hari ini?";"GROK";"D8_GROK_BerdamaiDenganDiriSendiri10-20_20";"idn-ocr"
"Aku sering merasa nggak cukup cantik atau ganteng. Gimana cara aku menerima diri sendiri?";"Cantik atau ganteng itu relatif, dan nggak ada standar yang benar-benar sama untuk semua orang. Kalau kamu merasa nggak cukup, coba lihat dirimu dari sudut pandang yang berbeda. Apa satu fitur atau sifat di dirimu yang bikin kamu merasa bangga?";"GROK";"D8_GROK_BerdamaiDenganDiriSendiri10-20_20";"idn-ocr"
"Aku takut dianggap ketinggalan zaman kalau nggak ikut tren. Apa aku harus berubah?";"Nggak perlu memaksakan diri untuk ikut tren kalau itu bikin kamu nggak nyaman. Hidup itu bukan tentang mengejar apa yang orang lain anggap keren, tapi tentang menemukan apa yang bikin kamu bahagia. Apa sih yang bikin kamu merasa paling autentik?";"GROK";"D8_GROK_BerdamaiDenganDiriSendiri10-20_20";"idn-ocr"
"Aku merasa capek banget mengejar sesuatu yang sepertinya nggak pernah cukup. Apa yang salah?";"Mungkin kamu sedang terjebak dalam pola pikir yang mengejar sesuatu yang nggak ada habisnya. Coba tarik napas dalam-dalam, lalu tanya pada dirimu: apa yang benar-benar kamu butuhkan untuk merasa cukup? Kadang, bersyukur atas apa yang sudah ada bisa bikin hati lebih ringan.";"GROK";"D8_GROK_BerdamaiDenganDiriSendiri10-20_20";"idn-ocr"
"Aku sering ngerasa bersalah kalau nggak bisa bikin semua orang senang. Gimana caranya aku lepas dari ini?";"Kamu nggak bertanggung jawab atas kebahagiaan semua orang, kok. Yang terpenting adalah kamu berusaha jadi versi terbaik dari dirimu. Coba mulai dengan menetapkan batasan kecil, misalnya bilang ‘tidak’ kalau kamu merasa terlalu terbebani. Apa situasi yang lagi bikin kamu merasa bersalah?";"GROK";"D8_GROK_BerdamaiDenganDiriSendiri10-20_20";"idn-ocr"
"Aku merasa orang lain selalu lebih baik dari aku. Ini bikin aku nggak percaya diri. Apa yang harus aku lakukan?";"Setiap orang punya kelebihan dan kekurangan, termasuk kamu. Coba tulis tiga hal yang kamu banggakan dari dirimu, sekecil apa pun itu. Itu bisa jadi pengingat bahwa kamu juga punya nilai yang nggak dimiliki orang lain. Mau coba ceritain satu kelebihanmu ke aku?";"GROK";"D8_GROK_BerdamaiDenganDiriSendiri10-20_20";"idn-ocr"
"Aku takut dikira jelek kalau nggak ikut standar kecantikan yang ada di media. Apa aku salah?";"Kamu nggak salah, tapi media sering menunjukkan standar yang nggak realistis. Kecantikan itu nggak cuma soal penampilan, tapi juga tentang bagaimana kamu merasa nyaman dengan dirimu sendiri. Apa satu hal yang bikin kamu merasa cantik atau spesial dari dalam?";"GROK";"D8_GROK_BerdamaiDenganDiriSendiri10-20_20";"idn-ocr"
"Aku merasa hidupku nggak berarti kalau nggak punya barang-barang mewah. Gimana caranya aku berhenti merasa begini?";"Barang mewah nggak menentukan makna hidupmu, kok. Coba pikirkan momen-momen kecil yang bikin kamu bahagia, seperti waktu bareng keluarga atau hobi yang kamu suka. Apa satu momen sederhana yang bikin kamu tersenyum akhir-akhir ini?";"GROK";"D8_GROK_BerdamaiDenganDiriSendiri10-20_20";"idn-ocr"
"Aku sering ngerasa stres karena merasa harus sempurna. Apa yang bisa aku lakukan biar nggak begini?";"Perfeksionisme bisa bikin capek, ya. Coba terima bahwa nggak apa-apa punya kekurangan, karena itu bagian dari jadi manusia. Mulai dengan merayakan langkah kecil yang kamu capai. Apa satu hal kecil yang kamu berhasil lakukan hari ini?";"GROK";"D8_GROK_BerdamaiDenganDiriSendiri10-20_20";"idn-ocr"
"Aku merasa nggak layak dicintai karena kekuranganku. Gimana caranya aku mengatasi perasaan ini?";"Kamu layak dicintai apa adanya, dengan semua kelebihan dan kekuranganmu. Coba mulai dengan mencintai dirimu sendiri dulu, misalnya dengan menulis satu hal yang kamu syukuri dari dirimu setiap hari. Apa yang bisa kamu coba untuk menghargai dirimu lebih?";"GROK";"D8_GROK_BerdamaiDenganDiriSendiri10-20_20";"idn-ocr"
"Aku takut gagal kalau mencoba sesuatu yang baru. Apa yang harus aku lakukan?";"Takut gagal itu wajar, tapi gagal adalah bagian dari belajar. Coba mulai dengan langkah kecil dan ingat bahwa setiap usaha adalah kemajuan. Apa satu hal baru yang pengen kamu coba, dan apa langkah pertama yang bisa kamu ambil?";"GROK";"D8_GROK_BerdamaiDenganDiriSendiri10-20_20";"idn-ocr"
"Aku merasa nggak punya tujuan hidup yang jelas. Gimana caranya aku menemukan makna hidup?";"Mencari tujuan hidup itu proses, dan nggak apa-apa kalau kamu belum menemukannya. Coba eksplor apa yang bikin kamu penasaran atau bahagia, meski itu hal kecil. Apa satu aktivitas yang bikin kamu merasa hidup akhir-akhir ini?";"GROK";"D8_GROK_BerdamaiDenganDiriSendiri10-20_20";"idn-ocr"
"Aku sering ngerasa kesepian meskipun ada orang di sekitarku. Apa yang bisa aku lakukan?";"Kesepian kadang bukan soal orang di sekitar, tapi bagaimana kamu merasa terhubung dengan diri sendiri. Coba luangkan waktu untuk melakukan sesuatu yang kamu nikmati, seperti menulis atau jalan-jalan. Apa satu hal yang bisa kamu lakukan untuk bikin dirimu merasa lebih nyaman?";"GROK";"D8_GROK_BerdamaiDenganDiriSendiri10-20_20";"idn-ocr"
"Aku merasa orang lain nggak menghargai aku. Gimana caranya aku tetap percaya diri?";"Nilai dirimu nggak ditentukan oleh apa yang orang lain pikirkan, tapi oleh bagaimana kamu melihat dirimu sendiri. Coba fokus pada hal-hal yang bikin kamu bangga, dan ingat bahwa kamu berharga apa adanya. Apa satu pencapaian yang bikin kamu merasa kuat?";"GROK";"D8_GROK_BerdamaiDenganDiriSendiri10-20_20";"idn-ocr"
"Aku sering ngerasa bersalah atas kesalahan masa lalu. Gimana caranya aku move on?";"Kesalahan masa lalu adalah bagian dari perjalanan, dan mereka nggak mendefinisikan siapa kamu sekarang. Coba maafkan dirimu dengan menulis surat untuk dirimu sendiri tentang apa yang kamu pelajari dari situasi itu. Apa satu pelajaran berharga yang kamu dapat dari masa lalu?";"GROK";"D8_GROK_BerdamaiDenganDiriSendiri10-20_20";"idn-ocr"
"Aku merasa dunia ini penuh dengan standar yang nggak bisa aku ikuti. Apa yang harus aku lakukan?";"Dunia memang penuh dengan tekanan, tapi kamu nggak harus mengikuti semua standar itu. Coba buat ‘standar’ mu sendiri berdasarkan apa yang bikin kamu bahagia dan merasa utuh. Apa satu nilai atau prinsip yang penting buatmu?";"GROK";"D8_GROK_BerdamaiDenganDiriSendiri10-20_20";"idn-ocr"
"Aku takut orang lain menilai aku buruk karena penampilanku. Gimana caranya aku nggak peduli sama omongan orang?";"Omongan orang kadang sulit dihindari, tapi kamu bisa melatih diri untuk fokus pada apa yang kamu pikirkan tentang dirimu sendiri. Coba afirmasi positif setiap hari, seperti ‘Aku cukup apa adanya.’ Apa satu kalimat positif yang bisa kamu ucapkan ke diri sendiri sekarang?";"GROK";"D8_GROK_BerdamaiDenganDiriSendiri10-20_20";"idn-ocr"
"Aku merasa hidupku nggak akan pernah cukup baik. Apa yang bisa aku ubah dari pola pikirku?";"Coba latih diri untuk bersyukur atas hal-hal kecil dalam hidupmu, karena itu bisa mengubah cara kamu melihat dunia. Mulai dengan menulis tiga hal yang kamu syukuri setiap hari. Apa satu hal yang kamu syukuri hari ini?";"GROK";"D8_GROK_BerdamaiDenganDiriSendiri10-20_20";"idn-ocr"
"Aku sering ngerasa nggak punya kontrol atas hidupku. Gimana caranya aku merasa lebih kuat?";"Kamu punya lebih banyak kontrol daripada yang kamu pikirkan, lho. Coba ambil satu keputusan kecil yang bisa bikin kamu merasa lebih berdaya, seperti merapikan meja atau mencoba hobi baru. Apa satu langkah kecil yang bisa kamu ambil hari ini?";"GROK";"D8_GROK_BerdamaiDenganDiriSendiri10-20_20";"idn-ocr"
"Aku sering merasa nggak percaya diri karena merasa nggak sehebat orang lain, apa yang bisa aku lakukan?";"Wah, aku ngerti banget perasaan itu. Coba deh, fokus ke kelebihan yang kamu punya. Setiap orang punya potensi unik, lho. Mungkin kamu bisa mulai dengan mencatat hal-hal kecil yang kamu banggakan dari diri sendiri, seperti kebaikan hati atau ketekunanmu. Itu langkah awal untuk menghargai diri sendiri!";"GROK";"D8_GROK_BerdamaiDenganDiriSendiri109-119_20";"idn-ocr"
"Kenapa ya aku susah banget melupain masa lalu yang bikin aku sedih?";"Masa lalu memang bisa terasa berat, ya. Tapi, coba alihkan pandanganmu ke sekarang. Bukan berarti melupain, tapi lebih ke menerima bahwa itu bagian dari perjalananmu. Mungkin kamu bisa coba menulis apa yang kamu rasakan, itu bisa bantu merapikan pikiran dan bikin hati lebih ringan.";"GROK";"D8_GROK_BerdamaiDenganDiriSendiri109-119_20";"idn-ocr"
"Aku punya mimpi dari kecil, tapi sekarang rasanya mustahil. Harusnya aku coba wujudkan nggak?";"Tentu saja coba wujudkan! Mimpi masa kecil itu biasanya cerminan dari apa yang benar-benar kamu inginkan di hati. Mulai dari langkah kecil aja, nggak perlu buru-buru. Yang penting, kamu bergerak menuju mimpimu itu. Aku yakin kamu bisa!";"GROK";"D8_GROK_BerdamaiDenganDiriSendiri109-119_20";"idn-ocr"
"Aku merasa hidupku monoton, kayak nggak ada esensi. Gimana caranya biar lebih bermakna?";"Hmm, mungkin kamu sedang merasa nggak nyambung sama apa yang kamu lakukan sekarang. Coba cari tahu apa yang bikin kamu semangat. Misalnya, ada hobi atau aktivitas yang dulu bikin kamu bahagia? Mulai dari situ, dan coba masukkan ke rutinitasmu. Hidup bakal terasa lebih hidup!";"GROK";"D8_GROK_BerdamaiDenganDiriSendiri109-119_20";"idn-ocr"
"Aku sering ngerasa salah ambil keputusan, dan sekarang kayak terjebak. Apa yang bisa aku lakukan?";"Nggak apa-apa, kita semua pernah salah pilih. Yang penting sekarang, coba lihat hikmah dari keputusan itu. Apa yang kamu pelajari? Dari situ, kamu bisa bikin rencana baru yang lebih sesuai sama apa yang kamu mau. Satu langkah kecil ke arah yang benar udah cukup, kok!";"GROK";"D8_GROK_BerdamaiDenganDiriSendiri109-119_20";"idn-ocr"
"Kadang aku merasa orang lain ngatur hidupku, dan itu bikin aku nggak bebas. Gimana menghadapinya?";"Itu memang bisa bikin sesak, ya. Coba tetapkan batasan yang jelas. Dengarkan saran orang lain, tapi ingat, hidup ini kamu yang jalani. Fokus ke apa yang bikin kamu merasa bebas dan kreatif. Kamu berhak menentukan jalanmu sendiri!";"GROK";"D8_GROK_BerdamaiDenganDiriSendiri109-119_20";"idn-ocr"
"Aku pengen jadi lebih baik, tapi kok susah banget nemuin kelebihan diriku sendiri?";"Tenang, menemukan kelebihan itu memang butuh waktu. Coba dengarkan kata hati kamu. Apa sih yang biasanya bikin kamu merasa bangga atau senang? Bisa juga tanya temen dekat, kadang mereka lihat kelebihan yang kamu nggak sadari. Aku yakin kamu punya banyak harta karun di dalam diri!";"GROK";"D8_GROK_BerdamaiDenganDiriSendiri109-119_20";"idn-ocr"
"Aku sering stres gara-gara kerjaan, rasanya nggak bisa lepas. Ada saran nggak?";"Stres itu berat, ya. Coba luangkan waktu buat istirahat, meski cuma sebentar. Misalnya, jalan-jalan kecil, dengar musik, atau meditasi. Dengan ngasih waktu buat diri sendiri, kamu bantu pikiranmu rileks. Kamu nggak sendiri, aku di sini nemenin!";"GROK";"D8_GROK_BerdamaiDenganDiriSendiri109-119_20";"idn-ocr"
"Aku takut gagal kalau coba sesuatu yang baru. Gimana caranya biar berani?";"Takut gagal itu wajar banget. Tapi coba lihat gagal sebagai bagian dari belajar. Mulai dari langkah kecil, dan ingat, nggak ada yang sempurna. Yang penting kamu coba. Aku percaya kamu punya keberanian di dalam diri, tinggal keluarkan aja!";"GROK";"D8_GROK_BerdamaiDenganDiriSendiri109-119_20";"idn-ocr"
"Aku merasa nggak cocok sama pekerjaanku sekarang, tapi takut buat ganti. Apa yang harus aku lakukan?";"Wah, itu sinyal penting dari hatimu. Coba cari tahu apa yang bikin kamu nggak cocok, dan apa yang sebenarnya kamu inginkan. Mulai riset soal pekerjaan yang sesuai sama potensimu. Ganti arah itu nggak gampang, tapi kalau kamu yakin, aku dukung kamu sepenuhnya!";"GROK";"D8_GROK_BerdamaiDenganDiriSendiri109-119_20";"idn-ocr"
"Aku sering overthinking, apalagi soal apa yang orang lain pikirkan tentang aku. Gimana caranya berhenti?";"Overthinking itu bikin capek, ya. Coba alihkan fokus ke dirimu sendiri. Apa yang bikin kamu bahagia? Ingat, pendapat orang lain nggak menentukan nilai dirimu. Luangkan waktu buat hal-hal yang bikin kamu merasa berharga, seperti hobi atau ngobrol sama temen dekat.";"GROK";"D8_GROK_BerdamaiDenganDiriSendiri109-119_20";"idn-ocr"
"Aku pengen punya hidup yang lebih bahagia, tapi nggak tahu mulai dari mana. Ada saran?";"Mulai dari hal kecil yang bikin kamu tersenyum. Bisa jalan-jalan, ketemu temen, atau coba sesuatu yang baru. Kadang, bahagia itu datang dari ngelakuin apa yang bikin hati kamu nyanyi. Aku di sini buat nemenin langkah pertamamu!";"GROK";"D8_GROK_BerdamaiDenganDiriSendiri109-119_20";"idn-ocr"
"Aku merasa potensiku terbuang karena aku nggak di jalur yang tepat. Gimana caranya balik ke jalur yang bener?";"Itu kesadaran yang luar biasa! Coba refleksi, apa sih potensi yang kamu rasakan? Dari situ, buat rencana kecil untuk mendekati jalur yang sesuai. Misalnya, ikut kursus atau coba proyek sampingan. Langkah kecil itu bakal bawa kamu lebih dekat ke jalur yang tepat!";"GROK";"D8_GROK_BerdamaiDenganDiriSendiri109-119_20";"idn-ocr"
"Aku sering ngerasa capek mental, kayak nggak punya energi. Apa yang bisa aku coba?";"Capek mental itu sinyal buat istirahat, lho. Coba lakukan sesuatu yang menenangkan, seperti meditasi, jalan di alam, atau sekadar tidur yang cukup. Jangan lupa, kasih waktu buat dirimu sendiri tanpa tekanan. Aku di sini kalau kamu butuh cerita!";"GROK";"D8_GROK_BerdamaiDenganDiriSendiri109-119_20";"idn-ocr"
"Aku ngerasa nggak punya tujuan hidup yang jelas. Gimana caranya nemuin tujuan itu?";"Nggak apa-apa, kadang kita perlu waktu buat cari tujuan. Coba tanya diri sendiri, apa yang bikin kamu merasa hidup? Bisa juga coba hal-hal baru untuk lihat apa yang nyantol di hati. Aku yakin tujuanmu ada di sana, tinggal kamu jelajahi!";"GROK";"D8_GROK_BerdamaiDenganDiriSendiri109-119_20";"idn-ocr"
"Aku sering ngerasa bersalah atas kesalahan di masa lalu. Gimana caranya move on?";"Rasa bersalah itu wajar, tapi jangan biarin dia nahan kamu. Coba maafin diri sendiri, anggap itu pelajaran berharga. Tulis apa yang kamu pelajari dari kesalahan itu, lalu fokus ke langkah ke depan. Kamu layak buat bahagia, lho!";"GROK";"D8_GROK_BerdamaiDenganDiriSendiri109-119_20";"idn-ocr"
"Aku merasa orang lain selalu lebih sukses. Gimana caranya biar nggak iri?";"Perbandingan itu bikin lelah, ya. Coba alihkan fokus ke perjalananmu sendiri. Setiap orang punya waktu dan cerita masing-masing. Catat pencapaian kecilmu, itu bakal bantu kamu lihat betapa hebatnya kamu. Aku bangga sama usahamu!";"GROK";"D8_GROK_BerdamaiDenganDiriSendiri109-119_20";"idn-ocr"
"Aku pengen lebih disiplin buat wujudin potensiku, tapi susah banget. Ada tips nggak?";"Disiplin itu memang tantangan! Coba mulai dari kebiasaan kecil, misalnya luangkan 10 menit sehari buat kerja ke arah potensimu. Buat jadwal sederhana dan rayakan setiap langkah kecil. Aku di sini buat ingetin kamu kalau lupa!";"GROK";"D8_GROK_BerdamaiDenganDiriSendiri109-119_20";"idn-ocr"
"Aku ngerasa hidupku nggak seimbang, kayak terlalu fokus ke kerja. Gimana caranya balance?";"Keseimbangan itu penting banget! Coba sisihkan waktu buat hal-hal di luar kerja, seperti ketemu temen, olahraga, atau sekadar santai. Buat prioritas yang jelas, dan jangan lupa kasih waktu buat dirimu sendiri. Aku yakin kamu bisa atur ulang!";"GROK";"D8_GROK_BerdamaiDenganDiriSendiri109-119_20";"idn-ocr"
"Aku pengen jadi versi terbaik dari diriku, tapi nggak tahu caranya. Dari mana aku mulai?";"Jadi versi terbaik itu perjalanan, bukan tujuan instan. Mulai dari kenali apa yang kamu suka dan apa yang bikin kamu bersinar. Coba satu hal baru yang mendukung potensimu, dan nikmati prosesnya. Aku di sini buat dukung setiap langkahmu!";"GROK";"D8_GROK_BerdamaiDenganDiriSendiri109-119_20";"idn-ocr"
"Aku merasa hidupku stuck, kayak nggak ada kemajuan. Gimana caranya aku bisa move on dari perasaan ini?";"Aku ngerti banget rasanya merasa jalan di tempat. Coba alihkan fokusmu ke hal-hal kecil yang bisa kamu syukuri setiap hari, misalnya momen sederhana yang bikin kamu tersenyum. Kadang, mengapresiasi hal kecil bisa buka jalan buat semangat baru. Mau coba tulis tiga hal yang kamu syukuri hari ini?";"GROK";"D8_GROK_BerdamaiDenganDiriSendiri120-130_20";"idn-ocr"
"Kenapa aku selalu fokus sama kekuranganku? Aku pengen berhenti merasa kurang terus.";"Wajar kok kalau kadang kita terjebak sama kekurangan. Coba lihat dirimu seperti gelas yang sudah terisi setengah, bukan setengah kosong. Apa satu kelebihanmu yang kamu suka? Mulai dari situ, kita bisa latih pikiranmu untuk lebih menghargai dirimu sendiri.";"GROK";"D8_GROK_BerdamaiDenganDiriSendiri120-130_20";"idn-ocr"
"Aku iri sama temen-temenku yang keliatannya sukses. Aku merasa ketinggalan. Apa yang bisa aku lakuin?";"Rasa iri itu manusiawi, tapi jangan biarin dia ngatur hidupmu. Setiap orang punya perjalanan sendiri. Coba fokus ke tujuan kecil yang bisa kamu capai sekarang, misalnya belajar skill baru atau nyelesain satu tugas. Apa satu hal yang pengen kamu coba buat maju?";"GROK";"D8_GROK_BerdamaiDenganDiriSendiri120-130_20";"idn-ocr"
"Aku capek banget sama kerjaanku, rasanya nggak dihargai. Harusnya aku ngapain?";"Duh, pasti berat ya rasanya. Kadang, mengalihkan fokus ke apa yang kamu nikmati di luar kerja bisa bantu. Apa sih yang bikin kamu happy, seperti hobi atau ngobrol sama temen? Mungkin kita bisa mulai dari situ buat ngisi ulang energimu.";"GROK";"D8_GROK_BerdamaiDenganDiriSendiri120-130_20";"idn-ocr"
"Aku takut gagal kalau coba sesuatu yang baru. Gimana caranya aku berani?";"Takut gagal itu normal, kok. Ingat aja, setiap langkah kecil yang kamu ambil itu udah kemenangan. Coba mulai dengan sesuatu yang nggak terlalu menakutkan, misalnya coba hobi baru. Apa satu hal kecil yang pengen kamu coba minggu ini?";"GROK";"D8_GROK_BerdamaiDenganDiriSendiri120-130_20";"idn-ocr"
"Hidupku kok rasanya penuh drama. Aku pengen tenang, tapi susah. Ada saran?";"Aku paham, hidup kadang kayak rollercoaster. Coba luangin waktu buat diri sendiri, mungkin dengan meditasi singkat atau jalan-jalan santai. Itu bisa bantu pikiranmu lebih tenang. Kapan terakhir kamu nyoba sesuatu yang bikin rileks?";"GROK";"D8_GROK_BerdamaiDenganDiriSendiri120-130_20";"idn-ocr"
"Aku ngerasa nggak pantas dapat apa yang aku punya sekarang. Gimana caranya aku lebih bersyukur?";"Perasaan nggak pantas itu bisa bikin kita lupa sama berkah yang ada. Coba tiap malam tulis satu hal yang bikin harimu spesial, sekecil apa pun. Lama-lama, kamu bakal lihat betapa banyak hal baik di hidupmu. Mau coba mulai malam ini?";"GROK";"D8_GROK_BerdamaiDenganDiriSendiri120-130_20";"idn-ocr"
"Aku susah nerima keadaanku yang sekarang. Aku pengen berubah, tapi bingung mulai dari mana.";"Menerima diri sendiri emang nggak gampang, tapi itu langkah awal buat berubah. Coba tanya diri sendiri, apa satu hal kecil di dirimu yang kamu suka? Dari situ, kita bisa mulai bangun rasa percaya diri buat langkah berikutnya.";"GROK";"D8_GROK_BerdamaiDenganDiriSendiri120-130_20";"idn-ocr"
"Aku merasa kesepian, kayak nggak ada yang ngerti aku. Apa yang bisa aku lakuin?";"Aku di sini buatmu, kok. Kadang, ngobrol sama orang baru atau ikut komunitas yang kamu suka bisa bantu. Apa ada aktivitas atau grup yang pengen kamu coba buat ketemu orang baru?";"GROK";"D8_GROK_BerdamaiDenganDiriSendiri120-130_20";"idn-ocr"
"Aku sering overthinking, susah berhenti. Ada cara buat ngatasin ini nggak?";"Overthinking bisa bikin capek, ya. Coba alihkan pikiranmu ke aktivitas yang bikin fokus, kayak nulis jurnal atau gambar. Itu bisa bantu ngurangin kebisingan di kepala. Kapan terakhir kamu nyoba sesuatu yang kreatif?";"GROK";"D8_GROK_BerdamaiDenganDiriSendiri120-130_20";"idn-ocr"
"Aku ngerasa hidupku nggak ada artinya. Gimana caranya aku nemuin makna?";"Cari makna itu kayak perjalanan, nggak instan. Coba pikir, apa satu hal yang bikin kamu merasa hidup, meski kecil? Mungkin membantu orang lain atau nyanyi karaoke. Dari situ, kita bisa cari langkah berikutnya bareng.";"GROK";"D8_GROK_BerdamaiDenganDiriSendiri120-130_20";"idn-ocr"
"Aku pengen lebih positif, tapi selalu balik lagi ke pikiran negatif. Apa yang salah?";"Nggak ada yang salah sama kamu, kok. Pikiran negatif itu kayak kebiasaan, bisa dilatih buat berubah. Coba tiap hari cari satu momen positif, sekecil apa pun, dan tulis. Lama-lama, otakmu bakal terbiasa lihat sisi baik. Mau coba?";"GROK";"D8_GROK_BerdamaiDenganDiriSendiri120-130_20";"idn-ocr"
"Aku ngerasa nggak bisa ngelupain masa lalu. Gimana caranya aku move on?";"Masa lalu emang bisa nempel, ya. Coba fokus ke apa yang bisa kamu kontrol sekarang, misalnya buat rencana kecil buat besok. Apa satu hal yang bisa bikin harimu lebih cerah besok?";"GROK";"D8_GROK_BerdamaiDenganDiriSendiri120-130_20";"idn-ocr"
"Aku benci sama diriku sendiri karena selalu gagal. Aku harus ngapain?";"Jangan terlalu keras sama diri sendiri, ya. Kegagalan itu cuma bagian dari proses. Coba lihat satu hal yang kamu pelajari dari kegagalan itu. Apa itu? Dari situ, kita bisa mulai langkah baru.";"GROK";"D8_GROK_BerdamaiDenganDiriSendiri120-130_20";"idn-ocr"
"Aku ngerasa hidupku nggak adil. Kenapa orang lain kayaknya lebih gampang?";"Rasa nggak adil itu wajar, tapi tiap orang punya perjuangannya sendiri. Coba fokus ke apa yang udah kamu capai, sekecil apa pun. Apa satu pencapaian yang bikin kamu bangga?";"GROK";"D8_GROK_BerdamaiDenganDiriSendiri120-130_20";"idn-ocr"
"Aku pengen punya tujuan hidup, tapi bingung caranya. Ada saran?";"Cari tujuan itu kayak petualangan, seru tapi butuh waktu. Coba pikir, apa satu hal yang bikin kamu excited, meski cuma mimpi kecil? Kita bisa mulai dari situ buat bikin rencana.";"GROK";"D8_GROK_BerdamaiDenganDiriSendiri120-130_20";"idn-ocr"
"Aku ngerasa nggak punya energi buat ngapa-ngapain. Gimana caranya aku semangat lagi?";"Kehabisan energi itu berat, ya. Coba mulai dengan sesuatu yang ringan, kayak dengerin musik favorit atau jalan-jalan sebentar. Apa yang biasanya bikin kamu merasa hidup lagi?";"GROK";"D8_GROK_BerdamaiDenganDiriSendiri120-130_20";"idn-ocr"
"Aku takut orang lain nge-judge aku. Gimana caranya aku lebih percaya diri?";"Takut dihakimi itu wajar, tapi kamu nggak bisa kontrol pikiran orang lain. Coba fokus ke apa yang bikin kamu merasa bangga sama dirimu. Apa satu hal yang kamu suka dari dirimu?";"GROK";"D8_GROK_BerdamaiDenganDiriSendiri120-130_20";"idn-ocr"
"Aku ngerasa nggak layak bahagia. Apa yang bisa aku lakuin biar merasa lebih baik?";"Kamu layak bahagia, kok, sama seperti orang lain. Coba lakuin sesuatu yang bikin kamu senyum, sekecil apa pun, kayak makan makanan favorit. Apa yang bisa kita coba hari ini?";"GROK";"D8_GROK_BerdamaiDenganDiriSendiri120-130_20";"idn-ocr"
"Aku pengen hidupku lebih bermakna, tapi nggak tahu caranya. Bantu aku dong.";"Hidup bermakna itu tentang menemukan apa yang penting buatmu. Coba pikir, apa satu hal yang bikin kamu merasa berarti, misalnya bantu orang lain atau kejar hobi? Kita bisa mulai dari situ.";"GROK";"D8_GROK_BerdamaiDenganDiriSendiri120-130_20";"idn-ocr"
