file;generator;question;answer;score_entailment;score_neutral;score_contradiction;score_final
FILOSOFI-TERAS-HENRY-MANAMPIRING-31-44;grok;Aku sering merasa sedih dan kayak nggak ada harapan. Aku takut ini tanda depresi. Apa yang harus aku lakuin?;Aku ngerti banget, rasa sedih yang berat itu nggak enak, ya. Kamu udah hebat karena sadar perasaanmu‚Äîitu langkah besar. Coba mulai dengan ngobrol sama orang yang kamu percaya, seperti temen atau keluarga, soal apa yang kamu rasain. Luangin waktu buat aktivitas kecil yang bikin seneng, seperti denger lagu favorit atau jalan di taman. Kalau perasaan ini berlangsung lama, pertimbangkan konsultasi ke psikolog‚Äînggak apa-apa minta bantuan, lho. Kamu nggak sendiri, dan kita bisa hadapi ini bareng.;0.9045;0.2003;0.3038;0.6007
FILOSOFI-TERAS-HENRY-MANAMPIRING-31-44;grok;Aku khawatir performaku di kantor nggak bagus, takut diomelin bos. Gimana caranya biar lebih percaya diri di kerja?;Khawatir soal performa itu wajar, kok, tapi kamu pasti bisa atasi. Coba buat daftar kecil apa aja yang udah kamu capai di kerja, sekecil apa pun‚Äîitu bantu ingetin kamu bahwa kamu capable. Kalau takut diomelin, coba proaktif: tanya bos apa yang bisa kamu perbaiki. Lalu, fokus sama satu tugas setiap hari yang bisa nunjukin kemampuanmu. Jangan lupa istirahat cukup biar fokus‚Äîkamu lebih hebat dari yang kamu pikir, lho. Yuk, coba satu langkah besok!;0.8162;0.1718;0.7611;0.0551
FILOSOFI-TERAS-HENRY-MANAMPIRING-31-44;grok;Aku sadar akhir-akhir ini gampang kesel sama keluarga gara-gara stres. Aku nggak mau gini terus. Apa yang bisa aku lakuin?;Aku ngerti, stres bisa bikin kita nggak sengaja nyakitin orang terdekat. Kamu udah hebat karena pengen berubah. Coba kenali apa yang bikin kamu stres‚Äîmungkin tulis di buku catatan. Kalau mulai kesel, tarik napas dalam beberapa kali sebelum ngomong. Luangin waktu buat quality time sama keluarga, kayak nonton film bareng, biar hubungan lebih hangat. Kalau perlu, minta maaf ke mereka dan bilang kamu lagi berus Verses: ubah kebiasaan ini. Kamu pasti bisa, satu langkah dulu!;0.8183;0.1462;0.7541;0.0642
FILOSOFI-TERAS-HENRY-MANAMPIRING-31-44;grok;Aku ngerasa hidupku penuh tekanan, pengen rileks tapi bingung caranya. Apa aktivitas yang bisa aku coba?;Tekanan hidup emang bisa bikin capek, ya. Coba mulai dengan sesuatu yang sederhana, seperti ngobrol sama temen dekat‚Äînggak perlu serius, ceritain aja hal lucu atau rencana weekend. Kalau suka aktivitas, jalan kaki di taman atau coba yoga dari YouTube bisa bikin tubuh dan pikiran lebih santai. Atau, luangin waktu buat hobi lama yang udah lama nggak disentuh, kayak gambar atau denger musik. Pilih satu yang paling gampang buatmu, dan lakuin besok‚Äîkamu layak istirahat, lho!;0.7944;0.1949;0.6448;0.1496
FILOSOFI-TERAS-HENRY-MANAMPIRING-31-44;grok;Aku pengen hidupku lebih bahagia, tapi bingung apa yang bikin aku seneng. Gimana caranya nemuin itu?;Aku ngerti, kadang kita lupa apa yang bikin kita bahagia. Coba ambil kertas dan tulis tiga hal, sekecil apa pun, yang pernah bikin kamu senyum‚Äîbisa makan makanan favorit, nonton sunset, atau ngobrol sama sahabat. Kalau susah ingat, coba lakuin sesuatu yang dulu kamu suka, seperti denger lagu lawas atau jalan-jalan. Tiap hari, lakuin satu hal dari daftar itu, meski cuma 10 menit. Lama-lama, kamu bakal nemuin apa yang bikin hatimu ringan. Yuk, mulai dari yang gampang!;0.7936;0.2284;0.8419;-0.0483
FILOSOFI-TERAS-HENRY-MANAMPIRING-31-44;grok;Aku baru balik dari luar negeri dan susah banget adaptasi di sini. Aku sering baper dan cemas. Apa yang bisa aku lakuin?;Adaptasi di tempat baru emang nggak gampang, apalagi kalau kultur beda. Kamu udah hebat bisa jalanin ini. Coba cari satu hal yang bikin kamu merasa ‚Äòdi rumah,‚Äô seperti masak makanan favorit atau ketemu temen lama. Kalau cemas, luangin waktu buat nulis apa yang bikin kamu baper‚Äîitu bantu pikiran lebih teratur. Ikut komunitas lokal, kayak klub buku atau olahraga, juga bisa bantu kamu connect. Kalau masih berat, ngobrol sama profesional nggak ada salahnya, lho. Kamu pasti bisa lewatin ini!;0.8704;0.1603;0.595;0.2754
FILOSOFI-TERAS-HENRY-MANAMPIRING-31-44;grok;Aku sayang banget sama pacarku, tapi orang tuaku nggak setuju. Aku stres mikirin ini. Gimana caranya biar nggak cemas terus?;Wah, situasi kayak gini pasti berat buat kamu. Aku saranin coba ngobrol terbuka sama pasanganmu dulu‚Äîapa rencana kalian ke depan dan gimana caranya hadapi ini bareng. Kalau memungkinkan, ajak orang tuamu ngobrol pelan-pelan, mungkin ceritain sisi baik pasanganmu yang mereka belum tahu. Buat jaga pikiranmu, coba lakuin aktivitas yang bikin rileks, seperti denger musik atau olahraga ringan. Ingat, kamu nggak sendiri‚Äîambil satu langkah kecil dulu, misalnya ngobrol sama pasangan besok. Kamu kuat, kok!;0.8699;0.1945;0.6235;0.2463
FILOSOFI-TERAS-HENRY-MANAMPIRING-63-89;grok;Aku sering merasa cemas dan susah berpikir jernih. Gimana caranya aku bisa lebih tenang dan pakai logika dalam keseharianku?;Aku ngerti, cemas itu bisa bikin pikiran kita kacau, ya. Coba mulai dengan tarik napas dalam beberapa kali saat kamu merasa panik‚Äîini bantu menenangkan pikiran. Lalu, kalau ada masalah, tulis apa yang bikin kamu cemas, dan tanya ke diri sendiri: ‚ÄòApa yang bisa aku lakuin sekarang?‚Äô Misalnya, kalau cemas soal kerjaan, fokus ke satu tugas kecil yang bisa diselesaikan hari ini. Dengan begitu, kamu latih pikiranmu buat berpikir jernih, langkah demi langkah. Kamu pasti bisa, mulai dari yang kecil dulu!;0.9181;0.2554;0.2471;0.671
FILOSOFI-TERAS-HENRY-MANAMPIRING-63-89;grok;Aku sering emosi dan ngeluh kalau sesuatu nggak berjalan sesuai rencana. Gimana caranya biar nggak gampang kesal?;Wah, emosi pas rencana berantakan itu wajar, kok. Coba kalau lagi kesal, ambil jeda sebentar‚Äîhitung sampai 10 atau jalan kaki 5 menit. Lalu, tanya ke diri sendiri: ‚ÄòApa yang bikin aku kesal, dan apa yang bisa aku ubah?‚Äô Misalnya, kalau macet bikin bete, putar musik favorit atau dengar podcast biar lebih santai. Dengan fokus ke apa yang bisa kamu kendalikan, seperti reaksimu, lama-lama kamu bakal lebih tenang. Yuk, coba satu cara dulu besok!;0.8736;0.2298;0.5014;0.3722
FILOSOFI-TERAS-HENRY-MANAMPIRING-63-89;grok;Aku gampang banget marah kalau ada yang nyalip di jalan. Rasanya pengen ngejar! Gimana caranya biar bisa lebih sabar?;Aku tahu, disalip di jalan itu bisa bikin darah naik, ya. Coba tarik napas dalam dan bilang ke diri sendiri, ‚ÄòIni nggakÂÄºÂæó kesel.‚Äô Ingat, kamu nggak bisa kontrol orang lain, tapi kamu bisa kontrol reaksimu. Kalau masih panas, putar lagu santai atau bayangin kamu lagi di tempat favoritmu. Fokus ke tujuanmu‚Äîmisalnya sampai tujuan dengan selamat‚Äîbikin pikiran lebih jernih. Kamu pasti bisa lebih sabar, mulai dari perjalanan berikutnya!;0.9415;0.2221;0.3215;0.62
FILOSOFI-TERAS-HENRY-MANAMPIRING-63-89;grok;Aku sering kesal sama temen yang suka nyebelin. Gimana caranya biar bisa tetap tenang dan nggak baper?;Aku ngerti, temen nyebelin bisa bikin emosi, ya. Coba lihat dari sisi lain: mungkin dia lagi punya masalah sendiri. Kalau dia nyebelin, tarik napas dalam, lalu fokus ke apa yang bisa kamu lakuin‚Äîmisalnya, balas dengan sopan atau alihkan topik. Kamu nggak bisa ubah sikapnya, tapi kamu bisa pilih untuk tetap tenang. Coba juga ngobrol sama temen lain yang bikin kamu happy. Yuk, latih sabarmu mulai dari interaksi berikutnya!;0.8914;0.3068;0.4137;0.4777
FILOSOFI-TERAS-HENRY-MANAMPIRING-63-89;grok;Aku suka iri sama pencapaian temen di medsos. Rasanya aku kurang sukses. Gimana caranya biar nggak gitu?;Perasaan iri itu manusiawi banget, apalagi lihat medsos yang penuh highlight hidup orang. Coba kurangin waktu scrolling, dan fokus ke apa yang udah kamu capai‚Äîtulis tiga hal yang kamu banggakan, sekecil apa pun. Lalu, buat satu tujuan kecil, misalnya belajar skill baru atau beresin tugas. Ingat, hidupmu punya jalur sendiri, dan kamu nggak perlu bandingin sama orang lain. Yuk, mulai dari satu langkah yang bikin kamu merasa bangga!;0.928;0.2171;0.4741;0.4539
FILOSOFI-TERAS-HENRY-MANAMPIRING-63-89;grok;Aku sering ngerasa hidupku penuh kebetulan buruk, kayak apes mulu. Gimana caranya biar nggak merasa gitu?;Aku tahu, pas apes bertubi-tubi rasanya dunia nggak adil, ya. Coba lihat kejadian buruk itu sebagai bagian dari cerita besar hidupmu‚Äîmungkin ada pelajaran di situ. Tulis satu hal yang bisa kamu syukuri hari ini, misalnya masih punya temen buat curhat. Lalu, fokus ke apa yang bisa kamu lakuin sekarang, seperti bikin rencana kecil buat besok. Dengan begitu, kamu bakal merasa lebih punya kendali. Kamu kuat, lho, coba mulai dari satu hal positif!;0.9411;0.1874;0.3617;0.5794
FILOSOFI-TERAS-HENRY-MANAMPIRING-63-89;grok;Aku ngerasa hidupku nggak adil, kenapa sih aku selalu dapat masalah? Gimana caranya biar lebih ikhlas?;Rasanya nggak adil itu wajar, kok, apalagi kalau masalah datang terus. Coba tulis apa yang bikin kamu merasa nggak adil, lalu tanya: ‚ÄòApa yang bisa aku pelajari dari ini?‚Äô Misalnya, kalau lagi ada konflik, mungkin kamu bisa belajar cara komunikasi yang lebih baik. Fokus ke langkah kecil yang bisa kamu ambil, seperti ngobrol sama orang terdekat atau lakuin hobi yang bikin tenang. Ikhlas itu proses, dan kamu pasti bisa lewatin dengan sabar. Yuk, mulai dari satu langkah!;0.9242;0.2563;0.4537;0.4705
FILOSOFI-TERAS-HENRY-MANAMPIRING-63-89;grok;Aku masih kesal sama masa laluku, kenapa sih aku lahir di keluarga yang susah? Gimana caranya biar nggak menyesal terus?;Aku ngerti, nyesel sama masa lalu itu berat, ya. Tapi coba lihat, kamu nggak bisa ubah masa lalu, tapi kamu bisa ubah cara pandangmu sekarang. Tulis tiga hal yang kamu suka dari dirimu sekarang‚Äîmungkin ketangguhanmu karena besar di situasi susah. Lalu, buat satu tujuan kecil, seperti nabung sedikit atau belajar sesuatu baru. Fokus ke apa yang bisa kamu lakuin hari ini bikin kamu lebih kuat. Kamu udah hebat sejauh ini, lho, yuk lanjutin!;0.9491;0.2018;0.291;0.6581
FILOSOFI-TERAS-HENRY-MANAMPIRING-63-89;grok;Aku sering ngerasa minder karena aku dari kampung, nggak kayak temenku yang dari kota. Gimana caranya biar lebih percaya diri?;Aku tahu, perasaan minder itu bisa bikin nggak nyaman, ya. Tapi coba lihat, asalmu dari kampung bikin kamu punya cerita unik yang nggak dimiliki orang lain. Tulis tiga hal yang kamu banggakan dari dirimu‚Äîmungkin kerja kerasmu atau kebaikanmu ke orang lain. Fokus ke apa yang bisa kamu lakuin, seperti belajar skill baru atau ngobrol sama temen yang suportif. Kamu berharga apa adanya, lho. Yuk, tunjukin ke dunia siapa kamu!;0.8307;0.2314;0.4143;0.4164
FILOSOFI-TERAS-HENRY-MANAMPIRING-63-89;grok;Aku stres banget karena temenku ngomongin aku di belakang. Gimana caranya biar nggak kepikiran terus?;Wah, dikomporin temen itu emang bikin kesel, ya. Aku ngerti. Coba ingat, kamu nggak bisa kontrol omongan orang, tapi kamu bisa kontrol reaksimu. Tulis apa yang bikin kamu kesal, lalu buang kertas itu‚Äîbantu bikin lega. Fokus ke hal yang bisa kamu lakuin, seperti ngobrol sama temen yang bikin kamu nyaman atau lakuin hobi favorit. Kamu nggak perlu buktikan apa-apa ke orang lain‚Äîkamu udah cukup berharga. Yuk, coba satu langkah buat tenangin pikiran!;0.9398;0.2052;0.456;0.4838
FILOSOFI-TERAS-HENRY-MANAMPIRING-63-89;grok;Aku baru gagal dapat proyek kerja, padahal udah usaha banget. Aku kecewa sama diriku. Gimana caranya move on?;Aku tahu, gagal padahal udah all-out itu nyesek banget. Tapi kamu udah hebat karena kasih yang terbaik. Coba tulis tiga hal yang kamu pelajari dari proses ini‚Äîmungkin cara presentasi atau manajemen waktu. Lalu, fokus ke langkah berikutnya, seperti cari proyek baru atau tingkatin skill. Ingat, keputusan klien bukan cerminan nilai dirimu. Kasih waktu buat istirahat, mungkin nonton film favorit, lalu bangkit lagi. Kamu pasti bisa, satu langkah dulu!;0.9405;0.1496;0.43;0.5105
FILOSOFI-TERAS-HENRY-MANAMPIRING-63-89;grok;Aku pengen orang lain suka sama aku, tapi kok susah banget. Gimana caranya biar nggak terobsesi sama opini orang?;Pengen disukai orang itu wajar, kok, tapi aku ngerti itu bisa bikin capek. Coba fokus ke apa yang kamu bisa kontrol, seperti bersikap ramah atau jujur sama diri sendiri. Tulis tiga hal yang kamu suka dari dirimu‚Äîmungkin humor atau kebaikanmu. Kalau ada yang nggak suka, ingat itu cuma opini mereka, bukan fakta soal dirimu. Luangin waktu buat hobi atau temen yang bikin kamu nyaman. Kamu udah keren apa adanya, lho. Yuk, coba satu hal positif hari ini!;0.8933;0.3098;0.3918;0.5015
FILOSOFI-TERAS-HENRY-MANAMPIRING-63-89;grok;Aku ngerasa bahagiaku tergantung sama pacar. Kalau dia nggak perhatian, aku sedih banget. Gimana caranya biar lebih mandiri?;Aku ngerti, rasanya pengen pacar selalu bikin kita happy, ya. Tapi coba mulai cari kebahagiaan dari dalam dirimu. Tulis tiga hal yang bikin kamu seneng, seperti nonton drama Korea atau jalan sama temen. Lalu, buat waktu buat diri sendiri‚Äîmisalnya, coba hobi baru atau meditasi 5 menit. Kalau pacar lagi sibuk, ingat kamu tetep berharga. Ngobrol terbuka sama dia juga bisa bantu. Kamu kuat kok, yuk mulai dari satu aktivitas yang bikin senyum!;0.7246;0.2536;0.5062;0.2184
FILOSOFI-TERAS-HENRY-MANAMPIRING-63-89;grok;Aku takut banget dikira jelek sama orang lain. Ini bikin aku nggak pede. Gimana caranya biar lebih percaya diri?;Takut dinilai orang itu wajar, tapi aku tahu itu bikin nggak nyaman. Coba tulis tiga hal yang kamu suka dari dirimu‚Äîmungkin matamu atau cara kamu peduli sama orang lain. Fokus ke apa yang bisa kamu lakuin, seperti pakai baju yang bikin pede atau senyum ke orang baru. Ingat, opini orang cuma opini, bukan fakta soal dirimu. Luangin waktu buat hal yang bikin happy, kayak denger musik. Kamu udah awesome, lho. Yuk, coba satu langkah kecil!;0.7679;0.2146;0.7251;0.0428
FILOSOFI-TERAS-HENRY-MANAMPIRING-63-89;grok;Aku stres karena keuangan lagi susah. Rasanya hidupku nggak akan bahagia tanpa duit. Gimana caranya biar nggak cemas?;Stres soal duit itu berat, ya, dan aku ngerti banget. Coba mulai dengan bikin catatan pengeluaran sederhana‚Äîlihat apa yang bisa dikurangin, misalnya bikin kopi di rumah. Lalu, fokus ke apa yang bikin kamu merasa kaya di hati, seperti ngobrol sama keluarga atau jalan di taman. Tulis satu tujuan kecil, seperti nabung 10 ribu sehari. Ingat, kebahagiaan nggak cuma dari duit‚Äîkamu punya banyak hal berharga. Yuk, coba satu langkah buat tenangin pikiran!;0.8247;0.2605;0.439;0.3856
FILOSOFI-TERAS-HENRY-MANAMPIRING-63-89;grok;Aku takut reputasiku hancur karena satu kesalahan di medsos. Gimana caranya biar nggak paranoia soal ini?;Aku tahu, medsos bisa bikin deg-degan soal reputasi, ya. Coba fokus ke apa yang bisa kamu kontrol: pikirin baik-baik sebelum posting, dan kalau ragu, tanya temen dulu. Tulis tiga hal yang bikin kamu bangga sama dirimu‚Äîitu yang bikin kamu berharga, bukan like di medsos. Kalau takut salah, kurangin waktu online dan lakuin hal offline, seperti baca buku atau olahraga. Kamu nggak perlu sempurna di mata orang lain. Yuk, coba satu posting positif hari ini!;0.8502;0.2031;0.4545;0.3957
FILOSOFI-TERAS-HENRY-MANAMPIRING-63-89;grok;Aku takut banget sakit, padahal udah jaga kesehatan. Gimana caranya biar nggak khawatir berlebihan?;Takut sakit itu wajar, apalagi kalau udah usaha jaga kesehatan. Coba fokus ke apa yang bisa kamu lakuin: makan sehat, tidur cukup, dan olahraga ringan. Tulis tiga hal yang bikin kamu bersyukur sama tubuhmu‚Äîmungkin matamu yang sehat atau kakimu yang kuat. Kalau khawatir muncul, tarik napas dalam dan bilang, ‚ÄòAku lakuin yang terbaik hari ini.‚Äô Luangin waktu buat hal yang bikin rileks, seperti meditasi 5 menit. Kamu udah hebat, lho, yuk lanjutin!;0.8857;0.2904;0.4136;0.4721
FILOSOFI-TERAS-HENRY-MANAMPIRING-63-89;grok;Aku sedih karena sahabatku tiba-tiba cuek. Aku takut kehilangan dia. Gimana caranya biar nggak sedih terus?;Aku ngerti, sahabat yang tiba-tiba cuek itu bikin hati nyesek. Coba ajak dia ngobrol pelan-pelan, tanya apa kabarnya‚Äîmungkin dia lagi ada masalah. Tapi ingat, kamu nggak bisa kontrol perasaannya, jadi fokus ke apa yang bisa kamu lakuin: tetap ramah dan jaga hubungan dengan temen lain yang suportif. Tulis tiga kenangan seru sama sahabatmu‚Äîitu bantu ingetin kamu soal momen bahagia. Kamu berharga, lho, dan pasti ada yang sayang sama kamu. Yuk, coba ngobrol sama dia!;0.845;0.2127;0.4169;0.428
FILOSOFI-TERAS-HENRY-MANAMPIRING-63-89;grok;Aku takut gagal di presentasi besok, rasanya deg-degan banget. Gimana caranya biar lebih berani?;Deg-degan sebelum presentasi itu normal, kok! Coba fokus ke apa yang bisa kamu siapin: latihan presentasi di depan cermin atau temen, dan pastiin slide-mu rapi. Tulis tiga hal yang bikin kamu pede‚Äîmungkin suaramu yang jelas atau kerja kerasmu. Ingat, hasilnya nggak sepenuhnya di tanganmu, tapi usahamu udah bikin kamu hebat. Tarik napas dalam sebelum mulai, dan bilang, ‚ÄòAku bisa!‚Äô Kamu pasti oke, yuk siapin satu slide lagi malam ini!;0.8292;0.2576;0.4972;0.332
FILOSOFI-TERAS-HENRY-MANAMPIRING-63-89;grok;Aku ngerasa hidupku dikontrol situasi yang nggak bisa aku ubah, kayak kerjaan yang bikin stres. Gimana caranya biar tetep happy?;Aku tahu, kerjaan yang bikin stres bisa bikin rasanya nggak bebas, ya. Coba fokus ke apa yang bisa kamu atur: misalnya, bikin to-do list biar kerjaan lebih teratur, atau minta feedback ke bos. Di luar kerja, luangin waktu buat hal yang bikin seneng, seperti nonton film atau jalan sama temen. Tulis satu hal kecil yang bikin kamu bersyukur di kerjaan‚Äîmungkin kolega yang asik. Dengan begitu, kamu tetep bisa nemuin bahagia. Yuk, coba satu langkah kecil besok!;0.8849;0.155;0.3566;0.5283
FILOSOFI-TERAS-HENRY-MANAMPIRING-63-89;grok;Aku lagi di situasi sulit, rasanya nggak punya kendali apa-apa. Gimana caranya tetep kuat mental?;Situasi sulit itu berat banget, dan aku ngerti kamu lagi berjuang. Coba fokus ke apa yang masih bisa kamu atur, seperti pikiran dan sikapmu. Tulis tiga hal kecil yang bikin kamu merasa kuat‚Äîmungkin tekadmu atau dukungan dari temen. Lakuin satu tindakan kecil setiap hari, seperti meditasi 5 menit atau ngobrol sama orang terdekat. Ingat, kamu punya kekuatan dalam dirimu, meski situasinya susah. Kamu hebat, lho, yuk coba satu langkah hari ini!;0.8676;0.2721;0.343;0.5245
FILOSOFI-TERAS-HENRY-MANAMPIRING-63-89;grok;Aku lagi sedih banget karena kehilangan orang tersayang. Gimana caranya biar bisa nemuin semangat lagi?;Kehilangan orang tersayang itu sakit banget, dan aku ngerti kamu lagi berat. Coba mulai dengan ngizinin diri kamu merasa sedih‚Äîitu bagian dari proses. Lalu, tulis satu kenangan indah sama orang itu yang bikin kamu tersenyum. Fokus ke tindakan kecil, seperti jalan-jalan atau telepon temen buat cerita. Ingat, kamu bisa pilih untuk bawa kenangan mereka dengan cinta. Kamu kuat, lho, dan mereka pasti bangga sama kamu. Yuk, coba satu langkah kecil hari ini!;0.8646;0.1903;0.437;0.4276
FILOSOFI-TERAS-HENRY-MANAMPIRING-63-89;grok;Aku ngerasa hidupku stuck, nggak ada kemajuan. Gimana caranya biar tetep semangat meski situasinya susah?;Rasanya stuck itu bikin lelah, ya, aku ngerti. Coba tulis satu hal kecil yang bisa kamu lakuin hari ini buat maju‚Äîmungkin beresin meja kerja atau baca artikel inspiratif. Fokus ke sikapmu: bilang ke diri sendiri, ‚ÄòAku bisa lewatin ini.‚Äô Luangin waktu buat hal yang bikin seneng, seperti denger lagu atau masak. Ingat, kemajuan nggak selalu besar‚Äîlangkah kecil juga berarti. Kamu pasti bisa, yuk mulai dari satu tindakan hari ini!;0.9365;0.2441;0.282;0.6545
FILOSOFI-TERAS-HENRY-MANAMPIRING-63-89;grok;Aku deg-degan banget mau kencan pertama, takut dia nggak suka aku. Gimana caranya biar lebih santai?;Kencan pertama emang bikin jantungan, ya! Aku ngerti. Coba fokus ke apa yang bisa kamu siapin: pakai baju yang bikin pede, datang tepat waktu, dan siapin topik obrolan ringan. Tulis tiga hal yang bikin kamu merasa oke‚Äîmungkin senyummu atau humor kamu. Ingat, kamu nggak bisa kontrol perasaannya, tapi kamu bisa jadi versi terbaik dirimu. Tarik napas dalam sebelum ketemu, dan nikmati momennya. Kamu pasti asik, lho, yuk coba santai dan enjoy!;0.808;0.2664;0.4132;0.3947
FILOSOFI-TERAS-HENRY-MANAMPIRING-63-89;grok;Aku stres karena nilai kuliahku jelek, padahal udah belajar keras. Gimana caranya biar nggak kecewa sama diri sendiri?;Aku tahu, usaha keras tapi nilai nggak bagus itu bikin nyesek. Kamu udah hebat karena belajar giat, lho. Coba fokus ke apa yang bisa kamu lakuin: tanya dosen apa yang bisa diperbaiki atau cari cara belajar baru, seperti bikin catatan visual. Tulis tiga hal yang kamu pelajari semester ini‚Äîitu bukti kamu berkembang. Ingat, nilai bukan cerminan dirimu. Luangin waktu buat istirahat, mungkin nonton film lucu. Yuk, coba satu langkah buat bangkit lagi!;0.7828;0.2018;0.6004;0.1824
FILOSOFI-TERAS-HENRY-MANAMPIRING-63-89;grok;Aku kerja keras, tapi nggak naik jabatan. Rasanya nggak dihargai. Gimana caranya biar tetep semangat kerja?;Aku ngerti, kerja keras tapi nggak dihargai itu bikin frustrasi. Coba fokus ke apa yang kamu bisa kontrol: lakuin tugas dengan baik, tanya feedback ke bos, atau tingkatin skill lewat kursus online. Tulis tiga pencapaianmu di kerja‚Äîmungkin proyek yang selesai atau ide yang diterima. Ingat, nilai dirimu nggak ditentuin jabatan. Luangin waktu buat hal yang bikin seneng, seperti olahraga atau ngobrol sama temen. Kamu hebat, lho, yuk coba satu tindakan kecil besok!;0.8587;0.2043;0.4695;0.3892
FILOSOFI-TERAS-HENRY-MANAMPIRING-63-89;grok;Aku sering ngerasa nggak cukup karena aku nggak lahir dari keluarga kaya. Gimana caranya biar lebih menerima diri sendiri?;Aku tahu, perasaan itu bisa bikin berat, ya. Tapi coba lihat, kamu punya kekuatan unik karena perjuanganmu. Tulis tiga hal yang bikin kamu bangga‚Äîmungkin kerja kerasmu atau caramu bantu orang lain. Fokus ke apa yang bisa kamu lakuin sekarang, seperti nabung sedikit atau belajar skill baru. Ingat, kamu nggak perlu kaya buat berharga. Luangin waktu buat hal yang bikin seneng, seperti jalan-jalan atau denger musik. Kamu udah luar biasa, lho!;0.8731;0.2133;0.4427;0.4304
FILOSOFI-TERAS-HENRY-MANAMPIRING-63-89;grok;Aku ngerasa hidupku selalu sial, kayak nasib buruk ngejar aku. Gimana caranya biar lebih positif?;Rasanya sial terus itu bikin capek, ya, aku ngerti. Coba lihat kejadian buruk sebagai bagian dari cerita hidupmu‚Äîmungkin ada hikmah di situ. Tulis satu hal yang kamu syukuri hari ini, seperti kesehatan atau temen yang asik. Fokus ke langkah kecil, seperti bikin rencana buat besok atau lakuin hobi. Ingat, kamu punya kuasa buat ubah sudut pandangmu. Kamu kuat, lho, yuk coba satu hal positif hari ini!;0.8239;0.268;0.3843;0.4396
FILOSOFI-TERAS-HENRY-MANAMPIRING-63-89;grok;Aku gampang kesal sama hal kecil, kayak tumpah kopi tadi pagi. Gimana caranya biar nggak emosian?;Hal kecil kayak tumpah kopi emang bisa bikin bete, ya. Coba kalau itu terjadi, tarik napas dalam dan bilang, ‚ÄòYa udah, nggak apa-apa.‚Äô Fokus ke apa yang bisa kamu lakuin, seperti bersihin tumpahan atau buat kopi baru. Tulis satu hal yang bikin kamu senyum hari ini‚Äîmungkin cuaca cerah atau lagu favorit. Dengan latih sabar di momen kecil, lama-lama kamu bakal lebih tenang. Yuk, coba santai di kejadian kecil berikutnya!;0.9211;0.2088;0.5279;0.3931
FILOSOFI-TERAS-HENRY-MANAMPIRING-63-89;grok;Aku ngerasa hidupku nggak lengkap tanpa barang branded. Gimana caranya biar nggak ngiri sama yang punya?;Aku ngerti, lihat orang punya barang branded bisa bikin pengen, ya. Coba tulis tiga hal yang bikin kamu merasa kaya di hati‚Äîmungkin keluargamu atau momen seru sama temen. Fokus ke apa yang bisa kamu lakuin, seperti nabung buat sesuatu yang bikin happy atau nikmati hal gratis kayak jalan di taman. Ingat, barang nggak nentuin nilai dirimu. Kamu udah cukup keren, lho. Yuk, coba satu hal yang bikin senyum hari ini!;0.8459;0.1761;0.5415;0.3044
FILOSOFI-TERAS-HENRY-MANAMPIRING-63-89;grok;Aku takut banget kena penyakit meski udah hidup sehat. Gimana caranya biar nggak cemas terus?;Takut penyakit itu wajar, apalagi kalau udah usaha sehat, ya. Coba fokus ke apa yang bisa kamu lakuin: makan bergizi, olahraga ringan, dan tidur cukup. Tulis tiga hal yang bikin kamu bersyukur sama tubuhmu‚Äîmungkin kakimu yang kuat atau tanganmu yang lincah. Kalau cemas muncul, tarik napas dalam dan bilang, ‚ÄòAku udah lakuin yang terbaik.‚Äô Luangin waktu buat hal yang bikin rileks, seperti meditasi. Kamu hebat, lho, yuk lanjutin gaya hidup sehatmu!;0.88;0.2914;0.2538;0.6262
FILOSOFI-TERAS-HENRY-MANAMPIRING-63-89;grok;Aku takut kehilangan temen karena kami jarang ketemu. Gimana caranya biar nggak sedih mikirin ini?;Aku ngerti, jarang ketemu temen bisa bikin kangen dan takut kehilangan, ya. Coba fokus ke apa yang bisa kamu lakuin: kirim pesan ringan atau ajak video call buat catch-up. Tulis tiga momen seru sama temen itu‚Äîitu bantu ingetin ikatan kalian. Ingat, kamu nggak bisa kontrol jadwalnya, tapi kamu bisa tetap jadi temen yang asik. Luangin waktu buat koneksi baru juga, misalnya ikut komunitas. Kamu berharga, lho, yuk coba hubungi dia besok!;0.8155;0.2652;0.5166;0.2989
FILOSOFI-TERAS-HENRY-MANAMPIRING-63-89;grok;Aku takut ambil risiko di kerja karena takut gagal. Gimana caranya biar lebih berani?;Takut gagal itu normal, kok, apalagi di kerja. Coba fokus ke apa yang bisa kamu siapin: riset baik-baik sebelum ambil langkah, atau tanya saran kolega. Tulis tiga hal yang bikin kamu pede‚Äîmungkin pengalamanmu atau ide kreatifmu. Ingat, hasilnya nggak sepenuhnya di tanganmu, tapi usahamu udah bikin kamu hebat. Tarik napas dalam sebelum mulai, dan bilang, ‚ÄòAku coba dulu.‚Äô Kamu pasti bisa, lho, yuk ambil satu risiko kecil besok!;0.8335;0.2085;0.3342;0.4993
