file;generator;question;answer;score_entailment;score_neutral;score_contradiction;score_final
FILOSOFI-TERAS-HENRY-MANAMPIRING-261-289;grok;Saya khawatir anak saya terlalu sensitif dan mudah menangis. Bagaimana cara membantunya?;Hai, anak yang sensitif itu seperti bunga yang lembut, butuh pelukan ekstra, ya! Yang penting, bikin dia merasa aman jadi dirinya. Coba peluk dia saat nangis, lalu bilang, ‚ÄòNggak apa, boleh sedih, kok.‚Äô Tanyain, ‚ÄòApa yang bikin kamu sedih?‚Äô Ajak dia ceritain perasaannya lewat gambar atau cerita. Puji sifat sensitifnya, ‚ÄòKamu perhatian banget, itu keren!‚Äô Apa yang lagi bikin anakmu mudah nangis? Ceritain, biar kita cari cara buat bikin dia lebih kuat!;0.8982;0.2191;0.3516;0.5467
FILOSOFI-TERAS-HENRY-MANAMPIRING-261-289;grok;Anak saya bilang temennya jual dan saya pengin marah ke orang tua temennya. Bagaimana cara tenang?;Aku tahu, dengar anak diperlakukan jahat itu seperti ada badai di hati, kan? Tapi, coba tarik napas dalam dulu, lalu ajak anakmu ngobrol, ‚ÄòApa yang kamu rasakan?‚Äô Bantu dia lihat bahwa perbuatan temennya nggak mendefinisikan dirinya. Kalau perlu, bicara santai sama guru atau orang tua temennya dengan kepala dingin. Apa yang lagi bikin kamu marah? Yuk, kita cari cara buat tangani ini dengan tenang biar anakmu juga belajar!;0.8601;0.2327;0.5188;0.3412
FILOSOFI-TERAS-HENRY-MANAMPIRING-261-289;grok;Anak saya stres kalau salah main piano di depan orang. Bagaimana cara bikin dia lebih santai?;Wah, main piano di depan orang itu memang seperti tampil di panggung besar, bikin deg-degan, ya! Coba tunjukkan bahwa salah itu seru dengan ceritain kesalahanmu, ‚ÄòDulu Mama salah nyanyi, semua ketawa, lucu!‚Äô Ajak dia main piano bareng di rumah, dan kalau salah, bilang, ‚ÄòHaha, nada kita unik!‚Äô Puji keberaniannya, ‚ÄòKamu mau main, hebat!‚Äô Apa yang lagi bikin anakmu stres? Ceritain, biar kita cari cara buat bikin dia enjoy main piano!;0.9205;0.2359;0.6335;0.287
FILOSOFI-TERAS-HENRY-MANAMPIRING-261-289;grok;Saya kesal karena anak saya nggak seaktif anak lain. Bagaimana cara menerima sifatnya?;Hai, kadang kita pengin anak kita kayak kembang api, tapi setiap anak punya sinar sendiri, kan? Sifat anak itu sebagian bawaan, dan itu di luar kendali kita. Coba fokus pada keunikannya, seperti ‚ÄòKamu nggak terlalu aktif, tapi selalu mikir dalam, keren!‚Äô Ajak dia ke aktivitas yang cocok, seperti baca buku atau main puzzle. Puji sifatnya, ‚ÄòKamu tenang, itu istimewa!‚Äô Apa yang lagi bikin kamu kesal? Yuk, kita cari cara buat peluk sifat anakmu!;0.9009;0.3192;0.5924;0.3085
FILOSOFI-TERAS-HENRY-MANAMPIRING-261-289;grok;Saya ingin anak saya peduli sama orang lain, tapi saya sendiri sibuk. Bagaimana cara mencontohkan?;Wah, keinginan anak peduli itu seperti menanam pohon kebaikan, tapi kadang kita lupa menyiram karena sibuk, ya? Coba mulai dari hal kecil: ajak anakmu bantu tetangga, seperti bawa kue, dan bilang, ‚ÄòSeru ya bikin orang senang!‚Äô Tunjukkan peduli dalam keseharian, seperti tanya kabar temen di depan anakmu. Puji kalau dia peduli, ‚ÄòKamu perhatian banget, hebat!‚Äô Apa yang lagi bikin kamu susah nunjukin peduli? Ceritain, biar kita cari cara bareng!;0.8741;0.2267;0.6232;0.2509
FILOSOFI-TERAS-HENRY-MANAMPIRING-261-289;grok;Anak saya takut coba olahraga baru karena takut jatuh. Bagaimana cara mendukungnya?;Hai, anak yang takut coba baru itu seperti burung kecil yang ragu terbang, tapi pasti bisa, kok! Coba dukung inisiatifnya dengan bilang, ‚ÄòJatuh nggak apa, yang penting coba, seru!‚Äô Ajak dia coba olahraga ringan, seperti sepeda, dan kalau jatuh, ketawa bareng, ‚ÄòHaha, kita petualang!‚Äô Puji keberaniannya, ‚ÄòKamu mau coba, hebat!‚Äô Apa yang lagi bikin anakmu takut? Ceritain, yuk, biar kita cari cara buat bikin dia semangat!;0.9479;0.2287;0.4349;0.513
FILOSOFI-TERAS-HENRY-MANAMPIRING-291-303;grok;Apa yang dimaksud dengan konsep kosmopolitan dalam hubungan antarmanusia?;Konsep kosmopolitan mengajarkan bahwa kita semua adalah 'warga dunia', bagian dari satu komunitas manusia yang sama. Ini berarti kita harus menyayangi dan berbuat baik kepada semua orang tanpa memandang perbedaan suku, agama, ras, atau latar belakang lainnya, seperti memperluas kasih sayang dari keluarga hingga seluruh umat manusia.;0.9811;0.1907;0.13;0.851
FILOSOFI-TERAS-HENRY-MANAMPIRING-291-303;grok;Bagaimana Hierocles menjelaskan cara kita memperluas kasih sayang kepada orang lain?;Hierocles mengibaratkan relasi sosial seperti lingkaran dengan diri kita di pusatnya. Lingkaran terdekat adalah keluarga, lalu meluas ke desa, kota, bangsa, dan akhirnya seluruh umat manusia. Kita diajak untuk memperluas kasih sayang dari lingkaran kecil, seperti keluarga, hingga ke lingkaran terbesar, yaitu semua manusia, dengan menyapa semua orang sebagai sahabat atau saudara.;0.953;0.5735;0.1527;0.8003
FILOSOFI-TERAS-HENRY-MANAMPIRING-291-303;grok;Saya sering berprasangka buruk terhadap orang dari latar belakang tertentu. Bagaimana cara mengubah pandangan ini?;Hai, wajar kok kadang kita punya prasangka, seperti bayangan yang muncul tanpa sengaja, ya? Coba buka hati untuk pengalaman baru, misalnya ngobrol sama orang dari latar belakang itu atau ikut kegiatan komunitas yang beragam. Tiap ketemu seseorang, anggap mereka ‚Äòsahabat‚Äô dulu, seperti saran Stoisisme. Ini bantu lunturkan prasangka. Orang seperti apa yang lagi bikin kamu berprasangka? Ceritain, yuk, biar kita cari cara buat ubah sudut pandangmu!;0.8729;0.1755;0.2354;0.6375
FILOSOFI-TERAS-HENRY-MANAMPIRING-291-303;grok;Saya merasa cukup kalau nggak menyakiti orang lain, tapi susah buat aktif membantu. Bagaimana cara mulai berbuat baik?;Aku tahu, kadang rasanya ‚Äònggak nyakitin aja udah cukup‚Äô, tapi Stoisisme bilang kita bisa lebih dari itu, lho! Coba mulai dari langkah kecil, seperti senyum ke tetangga atau bantu temen yang lagi susah. Bayangkan tiap kebaikan kecil kayak menanam benih kebahagiaan. Apa yang bikin kamu susah buat bantu orang lain? Ceritain, biar kita cari cara seru buat mulai berbuat baik bareng!;0.8801;0.1968;0.2536;0.6265
FILOSOFI-TERAS-HENRY-MANAMPIRING-291-303;grok;Saya merasa nggak bisa apa-apa soal masalah besar seperti polusi. Apa yang bisa saya lakukan biar nggak hopeless?;Hai, aku paham, masalah besar kayak polusi bisa bikin kita merasa kecil dan nggak berdaya, ya? Tapi, coba lihat ini: meski kamu nggak bisa kendalikan polusi sendirian, langkah kecil bareng orang lain bisa bikin perubahan! Mulai dari hal sederhana, seperti pakai botol minum reusable atau ikut komunitas daur ulang. Tiap aksi kecil itu kayak nyanyi bareng dalam paduan suara. Apa yang lagi bikin kamu hopeless? Yuk, kita cari satu langkah kecil buat bikin dunia lebih baik!;0.8835;0.1721;0.6998;0.1836
FILOSOFI-TERAS-HENRY-MANAMPIRING-291-303;grok;Saya takut ikut campur saat lihat ketidakadilan karena nggak mau bikin masalah. Bagaimana cara berani speak up?;Aku tahu, speak up itu kayak berdiri di tengah badai, bikin deg-degan, kan? Tapi, coba bayangkan kalau kamu yang dizalimi, pasti pengin ada yang bantu, ya? Mulai dari langkah kecil, seperti komen sopan di media sosial kalau lihat ketidakadilan, atau lapor kalau ada diskriminasi di sekitarmu. Ingat, keberanian itu salah satu kebajikan Stoisisme! Apa ketidakadilan yang lagi bikin kamu ragu? Ceritain, biar kita pikirkan cara buat kamu berani melangkah!;0.9347;0.2787;0.2504;0.6843
FILOSOFI-TERAS-HENRY-MANAMPIRING-291-303;grok;Saya sulit menerima orang yang beda agama atau budaya. Bagaimana cara lebih terbuka?;Hai, aku paham, kadang perbedaan itu bikin kita kayak ada tembok di hati, ya? Stoisisme bilang kita bisa latih kebajikan, seperti keadilan dan kebijaksanaan, dengan buka pikiran. Coba ikut acara budaya lain, seperti festival makanan atau seni, dan ngobrol sama orang dari latar belakang berbeda. Tanya, ‚ÄòApa sih yang bikin budayamu spesial?‚Äô Ini bikin tembok itu pelan-pelan runtuh. Apa yang lagi bikin kamu sulit terbuka? Ceritain, yuk, biar kita cari jalan buat hati lebih luas!;0.8892;0.1896;0.2887;0.6006
FILOSOFI-TERAS-HENRY-MANAMPIRING-291-303;grok;Apa itu konsep warga dunia dan mengapa itu penting untuk menghindari diskriminasi?;Konsep warga dunia menyatakan bahwa semua manusia berasal dari nenek moyang yang sama dan merupakan bagian dari satu komunitas global. Ini penting karena mengingatkan kita bahwa perbedaan fisik, seperti warna kulit, atau budaya hanyalah adaptasi lingkungan, bukan alasan untuk membedakan atau mendiskriminasi. Dengan melihat semua orang sebagai ‚Äòsaudara‚Äô, kita bisa membangun dunia yang lebih adil dan harmonis.;0.9664;0.1632;0.178;0.7883
FILOSOFI-TERAS-HENRY-MANAMPIRING-291-303;grok;Saya merasa nggak nyaman membantu orang yang beda keyakinan. Bagaimana cara mengatasi ketidaknyamanan ini?;Aku tahu, kadang membantu orang yang beda itu bikin ada rasa nggak nyaman, seperti langkah di luar zona aman, ya? Coba mulai dari hal kecil, seperti donasi anonim untuk komunitas yang beda keyakinan atau bantu tetangga tanpa tanya latar belakangnya. Bayangkan kebaikanmu kayak sinar matahari yang nggak pilih-pilih siapa yang disinari. Apa yang bikin kamu nggak nyaman? Ceritain, biar kita cari cara buat bikin hatimu lebih terbuka!;0.9018;0.2174;0.214;0.6877
FILOSOFI-TERAS-HENRY-MANAMPIRING-291-303;grok;Saya merasa masalah diskriminasi terlalu besar untuk diatasi. Apa yang bisa saya lakukan sebagai individu?;Hai, aku paham, diskriminasi itu kayak gunung besar yang bikin kita merasa kecil, ya? Tapi, setiap langkah kecil bisa bikin perubahan! Coba mulai dari lingkunganmu: kalau dengar komentar diskriminatif, bilang dengan sopan, ‚ÄòMenurutku kita nggak perlu beda-bedain, ya.‚Äô Atau, dukung kegiatan komunitas yang promosi keberagaman. Tiap aksi itu kayak batu kecil yang bikin longsor perubahan. Apa yang lagi bikin kamu merasaÊóÝÂäõ? Yuk, kita cari satu langkah buat bikin dunia lebih adil!;0.8484;0.2362;0.3715;0.4769
FILOSOFI-TERAS-HENRY-MANAMPIRING-291-303;grok;Saya takut dikucilkan kalau bela orang yang dizalimi. Bagaimana cara tetap berani?;Aku tahu, takut dikucilkan itu seperti berdiri sendirian di tengah keramaian, bikin ngeri, ya? Tapi, Stoisisme bilang keberanian itu kebajikan, dan puisi Niemoller ingatkan kalau diam bisa bikin kita jadi korban nantinya. Coba mulai dengan cara aman, seperti share postingan tentang keadilan di medsos atau dukung organisasi yang bela yang terzalimi. Kalau siap, tegur pelaku zalim dengan sopan. Apa yang lagi bikin kamu takut bela orang lain? Ceritain, biar kita pikirkan cara buat kamu berani tanpa takut!;0.883;0.1775;0.2992;0.5838
FILOSOFI-TERAS-HENRY-MANAMPIRING-291-303;grok;Saya kesal lihat temen share konten kebencian di medsos, tapi takut konflik kalau negur. Apa yang harus saya lakukan?;Aku tahu, lihat konten kebencian itu bikin hati panas, tapi takut konflik juga bikin ragu, ya? Stoisisme bilang keberanian itu penting, jadi coba tegur dengan cara elegan, seperti, ‚ÄòEh, menurutku konten ini bisa bikin orang tersakiti, apa nggak lebih baik share yang positif?‚Äô Atau, lapor konten itu secara anonim. Bayangkan tiap teguranmu kayak nyalain lilin di kegelapan. Apa konten yang lagi bikin kamu kesal? Ceritain, yuk, biar kita cari cara buat tangani tanpa drama!;0.8855;0.2149;0.2816;0.6038
FILOSOFI-TERAS-HENRY-MANAMPIRING-291-303;grok;Saya merasa nggak bisa ubah dunia yang penuh masalah, jadi pengin menyerah. Bagaimana cara tetap semangat?;Hai, aku paham, dunia yang penuh masalah itu kayak lautan badai yang bikin capek, ya? Tapi, amor fati bukan berarti pasif, lho‚Äîit‚Äôs about loving life sambil tetap berjuang! Coba pilih satu isu yang kamu peduli, misalnya kurangi plastik, dan mulai dari hal kecil, seperti bawa tas belanja kain. Gabung komunitas yang punya visi sama biar semangatmu terjaga. Apa isu yang lagi bikin kamu pengin nyerah? Ceritain, biar kita cari cara buat nyalain api semangatmu lagi!;0.9148;0.2187;0.2972;0.6176
FILOSOFI-TERAS-HENRY-MANAMPIRING-291-303;grok;Saya ingin peduli lingkungan, tapi bingung mulai dari mana. Apa langkah sederhana yang bisa saya coba?;Wah, keinginan peduli lingkungan itu kayak menanam pohon untuk masa depan, keren banget! Stoisisme bilang hidup selaras dengan alam itu penting, jadi coba mulai dari hal kecil: bawa botol minum sendiri, kurangi plastik sekali pakai, atau tanam tanaman di rumah. Tiap langkah itu kayak kasih napas baru buat bumi. Apa yang lagi bikin kamu bingung soal lingkungan? Ceritain, yuk, biar kita cari langkah simpel buat mulai!;0.8871;0.1393;0.3725;0.5146
FILOSOFI-TERAS-HENRY-MANAMPIRING-291-303;grok;Saya sering nggak peduli sama penderitaan orang yang beda dari saya. Bagaimana cara lebih empati?;Aku tahu, kadang penderitaan orang yang beda terasa jauh, seperti cerita di TV, ya? Tapi, Stoisisme bilang keadilan itu untuk semua orang. Coba latih empati dengan baca cerita orang dari latar belakang berbeda atau tonton dokumenter tentang isu sosial. Tanya diri sendiri, ‚ÄòKalau aku di posisi mereka, apa yang aku butuhin?‚Äô Mulai dari kebaikan kecil, seperti bantu tetangga yang beda keyakinan. Apa yang lagi bikin kamu nggak peduli? Ceritain, biar kita bantu hati kamu lebih terbuka!;0.8671;0.2111;0.2778;0.5893
FILOSOFI-TERAS-HENRY-MANAMPIRING-291-303;grok;Saya merasa perubahan iklim terlalu besar untuk diatasi. Bagaimana cara tetap optimis?;Hai, aku tahu, perubahan iklim itu kayak raksasa yang bikin kita merasa kerdil, ya? Tapi, Stoisisme bilang kalau kita kerja sama, masalah besar bisa jadi ‚Äòbisa dikendalikan‚Äô! Coba gabung komunitas lingkungan lokal, seperti yang ngadain bersih-bersih pantai, atau mulai kurangi karbon dengan naik sepeda. Optimisme datang dari aksi bareng temen. Apa yang lagi bikin kamu pesimis? Yuk, kita cari satu cara buat bikin kamu semangat bikin bumi lebih sejuk!;0.8315;0.2234;0.4699;0.3616
FILOSOFI-TERAS-HENRY-MANAMPIRING-291-303;grok;Saya kesal lihat keluarga share konten diskriminatif, tapi takut negur bikin hubungan renggang. Apa yang harus saya lakukan?;Aku tahu, negur keluarga itu kayak jalan di tali tipis, bikin deg-degan, ya? Stoisisme bilang keberanian itu kunci, jadi coba pendekatan lembut, seperti, ‚ÄòBuk, konten ini kayaknya bisa bikin orang sakit hati, apa nggak lebih baik share yang bikin senyum?‚Äô Atau, ajak diskusi santai, ‚ÄòMenurut Ibu, apa sih efek konten gini?‚Äô Ini bikin mereka mikir tanpa merasa diserang. Apa konten yang lagi bikin kamu kesal? Ceritain, biar kita cari cara buat negur dengan elegan!;0.8905;0.2092;0.2569;0.6336
FILOSOFI-TERAS-HENRY-MANAMPIRING-291-303;grok;Saya lihat temen dizalimi karena beda keyakinan, tapi takut ikut campur. Bagaimana cara bantu tanpa risiko besar?;Hai, aku paham, takut ikut campur itu seperti berdiri di pinggir jurang, bikin ragu, ya? Tapi, puisi Niemoller bilang diam bisa bikin kita jadi korban nanti. Coba bantu dengan cara aman, seperti dukung temenmu secara pribadi, ‚ÄòAku di sini buat kamu, ya,‚Äô atau lapor ketidakadilan itu ke pihak berwenang tanpa sebut nama. Kebaikan kecil itu kayak nyalain lilin di gelap. Apa yang lagi bikin temenmu dizalimi? Ceritain, biar kita pikirkan cara buat bantu dengan aman!;0.8477;0.1557;0.227;0.6207
FILOSOFI-TERAS-HENRY-MANAMPIRING-291-303;grok;Saya merasa nggak punya waktu buat bantu orang lain karena sibuk. Bagaimana cara tetap berbuat baik?;Aku tahu, hidup sibuk itu kayak lari di treadmill, nggak ada habisnya, ya? Tapi, Stoisisme bilang berbuat baik itu nggak harus besar. Coba sisihkan 5 menit sehari, seperti kirim pesan semangat ke temen atau donasi kecil ke amal. Bayangkan tiap kebaikan kayak taburan bintang di hidup orang lain. Apa yang lagi bikin kamu sibuk? Ceritain, yuk, biar kita cari cara buat selipin kebaikan di hari-harimu!;0.8601;0.222;0.4523;0.4077
FILOSOFI-TERAS-HENRY-MANAMPIRING-291-303;grok;Saya susah peduli sama penderitaan orang yang jauh atau beda dari saya. Bagaimana cara lebih peka?;Hai, aku tahu, kadang penderitaan orang jauh terasa seperti cerita di buku, nggak nyata, ya? Coba latih kepedulian dengan langkah kecil: baca berita tentang isu global, lalu tanya, ‚ÄòKalau aku di posisi mereka, apa yang aku rasain?‚Äô Atau, ikut donasi untuk bencana di daerah lain, sekecil apa pun. Ini bikin hati kamu lebih terhubung. Apa yang lagi bikin kamu susah peduli? Ceritain, biar kita bantu hati kamu lebih peka!;0.8836;0.1566;0.2335;0.6502
FILOSOFI-TERAS-HENRY-MANAMPIRING-291-303;grok;Saya sering merasa orang dari budaya lain nggak cocok sama saya. Bagaimana cara lebih menerima mereka?;Aku paham, perbedaan budaya kadang bikin kita kayak ada jarak, ya? Stoisisme bilang keadilan itu untuk semua, jadi coba dekatkan diri dengan cara seru, seperti coba makanan dari budaya lain atau tanya temen dari budaya itu, ‚ÄòCeritain dong tradisi favoritmu!‚Äô Ini bikin kamu lihat mereka sebagai ‚Äòsaudara‚Äô. Apa budaya yang lagi bikin kamu nggak cocok? Ceritain, yuk, biar kita cari cara buat bikin kamu lebih nyaman!;0.876;0.1639;0.3047;0.5713
FILOSOFI-TERAS-HENRY-MANAMPIRING-291-303;grok;Saya merasa nggak punya pengaruh buat ubah dunia yang penuh diskriminasi. Apa yang bisa saya lakukan?;Hai, aku tahu, diskriminasi itu kayak awan gelap yang bikin kita merasa nggak bisa apa-apa, ya? Tapi, Stoisisme bilang kalau kita bareng-bareng, kita punya kekuatan! Coba mulai dari lingkunganmu: kalau dengar lelucon diskriminatif, bilang, ‚ÄòKayaknya itu nggak lucu, deh.‚Äô Atau, dukung acara yang rayain keberagaman. Tiap langkah kecil itu kayak menyalakan lampu di kegelapan. Apa yang lagi bikin kamu merasa nggak berdaya? Yuk, kita cari cara buat bikin perubahan kecil!;0.8707;0.2644;0.3436;0.5272
FILOSOFI-TERAS-HENRY-MANAMPIRING-291-303;grok;Saya kesal lihat grup chat temen penuh konten rasis, tapi takut negur bikin dikucilkan. Apa yang harus saya lakukan?;Aku tahu, lihat konten rasis di grup chat itu bikin hati nggak nyaman, tapi takut dikucilkan juga bikin ragu, ya? Stoisisme bilang keberanian itu kebajikan, jadi coba negur dengan cara halus, seperti, ‚ÄòGuys, konten ini bisa nyakitin orang, apa nggak lebih baik share yang positif?‚Äô Atau, keluar dari grup kalau terlalu toxic dan cari komunitas yang lebih inklusif. Apa yang lagi bikin kamu kesal di grup itu? Ceritain, biar kita cari cara buat negur tanpa takut!;0.9354;0.1635;0.1835;0.7519
FILOSOFI-TERAS-HENRY-MANAMPIRING-291-303;grok;Saya pengin bantu atasi perubahan iklim, tapi merasa cuma setetes air di lautan. Bagaimana cara tetap termotivasi?;Wah, semangatmu buat bantu bumi itu kayak percikan api yang bisa nyalain perubahan, lho! Stoisisme bilang kalau kita bareng-bareng, setetes air itu bisa jadi lautan. Coba gabung komunitas lingkungan, seperti yang nanam pohon, atau mulai dari rumah: matiin lampu yang nggak kepake, kurangi plastik. Rayakan tiap langkah kecil, ‚ÄòYes, aku hemat energi!‚Äô Apa yang lagi bikin kamu merasa kecil? Ceritain, biar kita cari cara buat bikin semangatmu membara!;0.8777;0.1602;0.251;0.6267
FILOSOFI-TERAS-HENRY-MANAMPIRING-291-303;grok;Saya lihat tetangga didiskriminasi karena beda suku, tapi takut ikut campur. Bagaimana cara bantu tanpa konflik?;Hai, aku tahu, lihat tetangga didiskriminasi itu bikin hati nggak tenang, tapi takut konflik juga bikin ragu, ya? Puisi Niemoller bilang diam itu berisiko, jadi coba bantu dengan cara halus: ajak tetangga itu ngobrol, tunjukin kamu peduli, ‚ÄòKamu baik-baik aja, kan?‚Äô Atau, lapor ke RT kalau ada diskriminasi tanpa sebut nama. Kebaikan kecil itu kayak menanam benih perdamaian. Apa yang lagi bikin tetanggamu didiskriminasi? Ceritain, biar kita pikirkan cara buat bantu dengan aman!;0.8576;0.2159;0.3112;0.5464
FILOSOFI-TERAS-HENRY-MANAMPIRING-305-313;grok;Bagaimana pandangan Stoisisme terhadap kematian?;Stoisisme memandang kematian sebagai bagian alami dari Alam, sama seperti kelahiran. Kematian bukan sesuatu yang perlu ditakuti, karena ketakutan itu berasal dari anggapan kita sendiri. Dengan menerima kematian sebagai proses alami, kita bisa menghadapinya dengan tenang dan fokus pada menjalani hidup yang berkualitas.;0.9618;0.2008;0.2935;0.6683
FILOSOFI-TERAS-HENRY-MANAMPIRING-305-313;grok;Mengapa kualitas hidup lebih penting daripada panjang hidup menurut Stoisisme?;Kualitas hidup lebih penting karena hidup yang panjang tapi penuh kecemasan, kemarahan, atau mengejar hal-hal di luar kendali, seperti harta atau ketenaran, akan terasa sia-sia. Stoisisme mengajarkan untuk mengisi hidup dengan kebajikan, seperti keberanian dan kebijaksanaan, agar setiap momen bermakna, berapa pun lamanya.;0.8915;0.3204;0.4618;0.4297
FILOSOFI-TERAS-HENRY-MANAMPIRING-305-313;grok;Saya takut banget memikirkan kematian, rasanya menyeramkan. Bagaimana cara menghadapi ketakutan ini?;Hai, aku tahu memikirkan kematian itu bisa bikin jantungan, kayak bayangan gelap yang nggak mau pergi, ya? Stoisisme bilang ketakutan itu cuma dari pikiran kita sendiri. Coba ubah sudut pandang: bayangkan kematian sebagai bagian alami, seperti daun yang jatuh dari pohon. Mulai dengan latihan kecil, seperti tulis tiga hal yang bikin hidupmu berarti hari ini, biar fokus ke sekarang. Apa yang bikin kematian terasa menyeramkan buatmu? Ceritain, yuk, biar kita cari cara buat bikin hatimu lebih tenang!;0.7504;0.2416;0.6672;0.0832
FILOSOFI-TERAS-HENRY-MANAMPIRING-305-313;grok;Saya merasa nggak siap kalau tiba-tiba harus meninggal. Bagaimana cara menerima kematian dengan tenang?;Aku paham, rasanya kayak disuruh nyanyi di panggung tanpa latihan, bikin panik, ya? Marcus Aurelius bilang kita nggak pilih lahir, jadi kenapa stres soal pergi? Coba fokus jalani hari ini sebaik mungkin: lakukan satu kebaikan, seperti bantu temen atau nikmati kopi pagi. Tulis jurnal tentang apa yang bikin hidupmu indah, biar kamu merasa ‚Äòaku udah kasih yang terbaik‚Äô. Apa yang bikin kamu nggak siap? Ceritain, biar kita cari cara buat peluk ketakutan itu bareng!;0.8547;0.2078;0.7281;0.1266
FILOSOFI-TERAS-HENRY-MANAMPIRING-305-313;grok;Saya sering overthinking soal kematian sampai nggak bisa nikmati hidup. Bagaimana cara lebih santai?;Wah, overthinking soal kematian itu kayak stuck di film horor yang nggak kelar-kelar, ya? Epictetus punya cara asyik: kalau belum waktunya, nikmati ‚Äòmakan siang‚Äô dulu‚Äîartinya, jalani hidup sekarang! Coba buat ritual kecil, seperti jalan sore sambil denger musik favorit, atau tulis tiga hal yang bikin kamu senyum hari ini. Ini bantu pikiranmu balik ke momen sekarang. Apa yang lagi bikin kamu overthinking? Ceritain, biar kita cari cara buat bikin hidupmu lebih ringan!;0.8976;0.2407;0.2904;0.6072
FILOSOFI-TERAS-HENRY-MANAMPIRING-305-313;grok;Saya cemas kalau memikirkan akhir hidup, apalagi kalau tiba-tiba. Bagaimana cara tetap tenang seperti Julius Canus?;Aku tahu, cemas soal akhir hidup itu kayak ada awan gelap di kepala, ya? Julius Canus tunjukkin kita bisa tetap tenang dengan nikmati momen sekarang, kayak dia yang main catur sambil bercanda. Coba fokus pada apa yang kamu bisa kendalikan: buat hari ini spesial, misalnya masak makanan favorit atau telepon orang tersayang. Tulis satu hal yang bikin kamu bersyukur setiap malam. Apa yang bikin kamu cemas? Ceritain, yuk, biar kita cari cara buat bikin kamu lebih santai!;0.8389;0.2258;0.5545;0.2845
FILOSOFI-TERAS-HENRY-MANAMPIRING-305-313;grok;Saya merasa harus terkenal biar hidup saya berarti. Tapi kenapa saya nggak puas-puas?;Hai, kejar ketenaran itu kayak lari di treadmill, capek tapi nggak sampai mana-mana, ya? Stoisisme bilang ketenaran cuma ilusi, karena semua orang yang mengenang kita juga bakal dilupain. Coba alihkan fokus ke makna beneran: lakukan kebaikan kecil, seperti bantu tetangga, atau kejar hobi yang bikin hati senang. Tulis tiga hal yang bikin hidupmu berarti tanpa perlu applaus orang lain. Apa yang lagi bikin kamu nggak puas? Ceritain, biar kita cari cara buat bikin hidupmu lebih penuh!;0.786;0.2371;0.4603;0.3257
FILOSOFI-TERAS-HENRY-MANAMPIRING-305-313;grok;Saya sering merasa hidup saya nggak bermakna, cuma rutinitas. Bagaimana cara bikin hidup lebih berkualitas?;Aku tahu, rutinitas itu kadang bikin hidup kayak film hitam-putih, ya? Stoisisme bilang hidup berkualitas itu bebas dari emosi negatif dan penuh kebajikan. Coba mulai dengan satu tindakan kecil setiap hari, seperti bantu temen atau ambil waktu buat mikir, ‚ÄòApa yang bikin aku bangga hari ini?‚Äô Tulis tiga momen kecil yang bikin kamu merasa hidup, misalnya senyum orang yang kamu bantu. Apa yang lagi bikin hidupmu terasa kosong? Ceritain, biar kita cari warna buat hari-harimu!;0.8595;0.2464;0.558;0.3015
FILOSOFI-TERAS-HENRY-MANAMPIRING-305-313;grok;Bagaimana Stoisisme membantu kita menghadapi kematian orang tersayang?;Stoisisme membantu kita melihat kematian orang tersayang sebagai bagian alami dari Alam, seperti daun yang gugur. Meski duka itu wajar, kita bisa memaknai kehilangan dengan bersyukur atas waktu yang pernah dibagi bersama mereka, lalu fokus pada kebajikan, seperti menghormati kenangan mereka dengan tindakan baik. Ini membantu kita menerima kehilangan dengan lebih tenang sambil tetap menjalani hidup yang bermakna.;0.9489;0.132;0.4178;0.5311
FILOSOFI-TERAS-HENRY-MANAMPIRING-305-313;grok;Saya baru kehilangan orang tua dan merasa hidup nggak adil. Bagaimana cara menerima kehilangan ini?;Hai, kehilangan orang tua itu kayak kehilangan bagian dari hati, aku tahu rasanya berat banget. Marcus Aurelius bilang hidup itu seperti drama yang Alam tulis, dan kita nggak bisa pilih kapan tirai turun. Coba peluk kenangan indah dengan orang tuamu: tulis satu momen yang bikin kamu tersenyum, lalu tanya, ‚ÄòBagaimana aku bisa hormatin mereka lewat hidupku?‚Äô Misalnya, lakukan kebaikan yang mereka ajarkan. Apa yang lagi bikin kamu merasa nggak adil? Ceritain, biar kita cari cara buat pelan-pelan berdamai.;0.839;0.2287;0.5153;0.3237
