file;generator;question;answer;score_entailment;score_neutral;score_contradiction;score_final
FILOSOFI-TERAS-HENRY-MANAMPIRING-191-227;grok;Aku kesal sama adik yang selalu main HP pas makan bareng. Gimana caranya biar nggak jengkel?;Adik main HP pas makan bisa bikin bete, tapi coba ajak dia ngobrol santai: ‚ÄòEh, kita ngobrol yuk, lebih seru.‚Äô Tanyain diri: ‚ÄòBisa nggak aku ubah kebiasaannya?‚Äô Kalau nggak mau berubah, fokus ke apa yang kamu nikmati, seperti makanan enak. Tulis tiga momen seru bareng adikmu biar nggak kesel. Kalau masih susah, tahan diri dengan tarik napas dalam. Coba mulai obrolan seru pas makan besok.;0.932;0.1364;0.3889;0.5431
FILOSOFI-TERAS-HENRY-MANAMPIRING-191-227;grok;Aku capek ngadepin temen yang selalu ngeluh. Gimana caranya biar nggak habis energi?;Temen yang ngeluh terus bisa bikin lelah. Tanyain diri: ‚ÄòWorth it nggak habisin waktu buat dia?‚Äô Tulis tiga hal yang bikin kamu happy, seperti hobi atau temen lain. Kurangin waktu bareng dia pelan-pelan, seperti tolak ajakan sekali-dua. Fokus ke orang yang bikin kamu semangat, atau nikmati waktu sendiri dengan buku. Waktumu berharga, lho. Coba rencanain satu aktivitas seru buat diri sendiri minggu ini.;0.8715;0.2041;0.3284;0.543
FILOSOFI-TERAS-HENRY-MANAMPIRING-191-227;grok;Aku takut jujur ke temen soal perasaanku, takut dia marah. Gimana caranya biar berani jujur?;Takut jujur emang bikin grogi, tapi coba tanya: ‚ÄòLebih enak nggak kalau aku jujur?‚Äô Tulis tiga alasan kenapa jujur penting, seperti bikin hati lega. Mulai dengan ngomong santai, seperti, ‚ÄòBoleh nggak aku cerita soal perasaanku?‚Äô Bayangin dia dengerin dengan baik, rasanya ringan, kan? Jujur bikin kamu lebih tenang. Coba tulis apa yang mau kamu bilang ke temen itu malam ini.;0.9171;0.1638;0.3124;0.6048
FILOSOFI-TERAS-HENRY-MANAMPIRING-191-227;grok;Aku ngerasa temenku palsu, cuma manfaatin aku. Gimana caranya biar nggak stuck di pertemanan ini?;Temen yang cuma manfaatin bisa bikin capek hati. Tanyain diri: ‚ÄòBikin aku bahagia nggak pertemanan ini?‚Äô Tulis tiga hal yang bikin kamu merasa berharga, seperti kebaikanmu. Kurangin kontak pelan-pelan, seperti tolak ajakan atau fokus ke temen lain yang tulus. Cari komunitas baru, seperti grup hobi, buat ketemu orang positif. Kamu layak punya temen yang beneran care. Coba hubungi temen lain yang suportif besok.;0.9077;0.2082;0.5356;0.3721
FILOSOFI-TERAS-HENRY-MANAMPIRING-191-227;grok;Aku gampang marah kalau disalip di jalan. Gimana caranya biar nggak naik darah?;Disalip di jalan bisa bikin panas, tapi coba stop dulu. Hitung sampai sepuluh, lalu tanya: ‚ÄòBikin aku lebih cepet nggak kalau marah?‚Äô Fakta cuma disalip, bukan serangan pribadi. Putar lagu favorit atau fokus ke nyetir aman. Tulis tiga hal yang bikin kamu tenang, seperti tujuanmu hari ini. Marah cuma bikin capek diri sendiri. Coba siapin playlist santai buat di jalan besok.;0.7718;0.2594;0.4754;0.2964
FILOSOFI-TERAS-HENRY-MANAMPIRING-191-227;grok;Aku sakit hati gara-gara dikira cupu di sekolah. Gimana caranya biar nggak terlalu peduli?;Dikira cupu bisa bikin nggak enak, tapi coba tanya: ‚ÄòBener nggak aku cupu cuma karena kata orang?‚Äô Tulis tiga hal yang bikin kamu bangga, seperti prestasi atau kebaikanmu. Abaikan omongan itu atau balas dengan senyum, fokus ke temen yang ngerti kamu. Kamu lebih keren dari kata-kata mereka. Coba lakuin satu hal yang bikin kamu pede, seperti pakai outfit favorit besok.;0.904;0.2483;0.3074;0.5966
FILOSOFI-TERAS-HENRY-MANAMPIRING-191-227;grok;Aku jengkel sama kolega yang selalu nyolot tiap rapat. Gimana caranya biar nggak kesel?;Kolega nyolot bisa bikin bete, tapi coba balas dengan kalem. Tanyain diri: ‚ÄòKalau aku santai, apa dia bakal lanjut nyolot?‚Äô Tulis tiga hal yang bikin kamu tenang, seperti proyek yang selesai. Balas omongannya dengan sopan, seperti, ‚ÄòOke, mungkin kita bisa diskusi ini.‚Äô Fokus ke langkah kecil, seperti catat ide buat rapat berikutnya. Keramahan itu kekuatan. Coba balas satu omongan nyolot dengan sopan besok.;0.9128;0.18;0.3474;0.5654
FILOSOFI-TERAS-HENRY-MANAMPIRING-191-227;grok;Aku marah sama tetangga yang buang sampah sembarangan. Gimana caranya biar nggak emosi?;Buang sampah sembarangan bisa bikin panas, tapi coba tanya: ‚ÄòDia tahu nggak sih itu salah?‚Äô Mungkin dia nggak sadar dampaknya. Tarik napas dalam, lalu ajak ngobrol santai, seperti, ‚ÄòEh, sampahnya mungkin bisa di tong ya.‚Äô Tulis tiga hal yang bikin kamu bersyukur, seperti lingkungan yang masih oke. Fokus ke langkah kecil, seperti bikin poster soal sampah. Yuk, coba ngobrol sama tetangga besok.;0.856;0.2465;0.597;0.259
FILOSOFI-TERAS-HENRY-MANAMPIRING-191-227;grok;Aku gampang emosi kalau adikku cuek pas aku ngajak ngobrol. Gimana caranya biar lebih sabar?;Adik yang cuek bisa bikin kesel, tapi coba stop dulu. Tarik napas dalam, lalu tanya: ‚ÄòFakta apa? Dia cuma nggak respons, bukan benci aku.‚Äô Tulis tiga momen seru bareng adikmu, seperti main bareng. Coba ajak ngobrol dengan topik yang dia suka, seperti game. Kalau masih cuek, fokus ke hal yang bikin kamu senang, seperti nonton series. Sabar itu kekuatan. Yuk, coba ajak ngobrol soal hobinya besok.;0.8878;0.1626;0.7382;0.1496
FILOSOFI-TERAS-HENRY-MANAMPIRING-191-227;grok;Aku kesal sama temen yang selalu telat janjian. Gimana caranya biar nggak jengkel?;Temen telat bisa bikin bete, tapi coba sapa dia santai: ‚ÄòEh, mungkin kita set jam pasti ya biar pas.‚Äô Tanyain diri: ‚ÄòBisa nggak aku ubah kebiasaannya?‚Äô Kalau nggak berubah, bawa buku atau denger musik biar santai nunggu. Tulis tiga hal seru bareng temen itu biar nggak kesel. Kalau masih susah, tahan diri dengan tarik napas dalam. Coba bawa buku buat nunggu besok.;0.9542;0.151;0.3688;0.5853
FILOSOFI-TERAS-HENRY-MANAMPIRING-191-227;grok;Aku capek ngadepin keluarga yang selalu nanya kapan nikah. Gimana caranya biar nggak habis energi?;Pertanyaan ‚Äòkapan nikah‚Äô bisa bikin lelah. Tanyain diri: ‚ÄòWorth it nggak habisin energi buat ini?‚Äô Tulis tiga hal yang bikin kamu bahagia, seperti hobi atau temen. Balas dengan santai, seperti, ‚ÄòNanti deh, lagi fokus kerja.‚Äô Kurangin waktu ngobrol soal itu, dan fokus ke orang yang bikin kamu semangat. Waktumu berharga, lho. Coba alihkan obrolan ke topik seru sama keluarga besok.;0.8575;0.2625;0.4887;0.3689
FILOSOFI-TERAS-HENRY-MANAMPIRING-191-227;grok;Aku takut jujur ke bos soal kesalahan kerjaku, takut dimarahin. Gimana caranya biar berani?;Takut jujur ke bos emang bikin grogi, tapi coba tanya: ‚ÄòLebih tenang nggak kalau aku jujur?‚Äô Tulis tiga alasan kenapa jujur penting, seperti bikin hati lega. Mulai dengan ngomong santai, seperti, ‚ÄòBoleh nggak saya ceritain soal ini?‚Äô Bayangin bos ngerti dan kasih solusi, rasanya ringan, kan? Jujur bikin kamu lebih kuat. Coba tulis apa yang mau kamu bilang ke bos malam ini.;0.9258;0.1589;0.2863;0.6395
FILOSOFI-TERAS-HENRY-MANAMPIRING-191-227;grok;Aku ngerasa temenku cuma deket kalau butuh bantuan. Gimana caranya biar nggak stuck di pertemanan ini?;Temen yang cuma deket pas butuh bisa bikin capek. Tanyain diri: ‚ÄòBikin aku bahagia nggak pertemanan ini?‚Äô Tulis tiga hal yang bikin kamu merasa berharga, seperti kebaikanmu. Kurangin kontak pelan-pelan, seperti tolak ajakan atau fokus ke temen lain yang tulus. Cari komunitas baru, seperti grup olahraga, buat ketemu orang positif. Kamu layak punya temen yang beneran care. Coba hubungi temen lain yang suportif besok.;0.8857;0.2019;0.4275;0.4582
FILOSOFI-TERAS-HENRY-MANAMPIRING-191-227;grok;Aku gampang marah kalau disenggol di kereta. Gimana caranya biar nggak naik darah?;Disenggol di kereta bisa bikin panas, tapi coba stop dulu. Hitung sampai sepuluh, lalu tanya: ‚ÄòBikin aku lebih nyaman nggak kalau marah?‚Äô Fakta cuma disenggol, bukan serangan pribadi. Putar lagu favorit atau fokus ke tujuanmu. Tulis tiga hal yang bikin kamu tenang, seperti rencana hari ini. Marah cuma bikin capek diri sendiri. Coba siapin playlist santai buat di kereta besok.;0.8676;0.2812;0.4271;0.4405
FILOSOFI-TERAS-HENRY-MANAMPIRING-191-227;grok;Aku sakit hati gara-gara dikira miskin gara-gara bajuku sederhana. Gimana caranya biar nggak baper?;Dikira miskin bisa bikin nggak enak, tapi coba tanya: ‚ÄòBener nggak aku miskin cuma karena baju?‚Äô Tulis tiga hal yang bikin kamu bangga, seperti kerja keras atau kebaikanmu. Abaikan omongan itu atau balas dengan senyum, fokus ke temen yang ngerti kamu. Kamu lebih berharga dari kata-kata mereka. Coba pakai baju favorit dengan pede besok.;0.8982;0.2745;0.3387;0.5595
FILOSOFI-TERAS-HENRY-MANAMPIRING-191-227;grok;Aku jengkel sama penutup yang kasar di toko. Gimana caranya biar nggak kesel?;Penutup kasar bisa bikin bete, tapi coba balas dengan sopan. Tanyain diri: ‚ÄòKalau aku ramah, apa dia bakal lanjut kasar?‚Äô Tulis tiga hal yang bikin kamu tenang, seperti belanjaan yang udah beres. Ucapin ‚Äòterima kasih‚Äô dengan senyum, atau fokus ke hal lain yang bikin senang. Keramahan itu kekuatan. Coba balas kasar dengan sopan di toko besok, lihat reaksinya.;0.9244;0.2759;0.3602;0.5641
FILOSOFI-TERAS-HENRY-MANAMPIRING-191-227;grok;Aku marah sama temen yang gossipin aku. Gimana caranya biar nggak emosi?;Gossip bisa bikin sakit hati, tapi coba tanya: ‚ÄòDia sengaja nggak ya?‚Äô Mungkin dia nggak sadar itu menyakitimu. Tarik napas dalam, lalu ajak ngobrol santai, seperti, ‚ÄòEh, aku denger ada gossip, bener nggak?‚Äô Tulis tiga hal yang bikin kamu bersyukur, seperti temen lain yang suportif. Fokus ke langkah kecil, seperti jaga jarak kalau perlu. Yuk, coba ngobrol sama temen itu besok.;0.9035;0.2016;0.2925;0.611
FILOSOFI-TERAS-HENRY-MANAMPIRING-191-227;grok;Aku gampang emosi kalau pacarku lupa bales chat. Gimana caranya biar lebih sabar?;Pacar lupa bales bisa bikin kesel, tapi coba stop dulu. Tarik napas dalam, lalu tanya: ‚ÄòFakta apa? Dia cuma lupa bales, bukan nggak sayang.‚Äô Tulis tiga momen manis bareng pacarmu, seperti kencan terakhir. Kirim pesan ringan lagi atau fokus ke hobi yang bikin senang. Kalau masih cuek, ajak ngobrol jujur. Sabar itu kekuatan. Coba kirim pesan santai ke pacar besok.;0.8463;0.1982;0.5065;0.3398
FILOSOFI-TERAS-HENRY-MANAMPIRING-191-227;grok;Aku kesal sama kolega yang selalu nyanyi keras di kantor. Gimana caranya biar nggak jengkel?;Kolega nyanyi keras bisa bikin bete, tapi coba sapa dia santai: ‚ÄòEh, lagunya oke, tapi mungkin pelan dikit ya di kantor.‚Äô Tanyain diri: ‚ÄòBisa nggak aku ubah kebiasaannya?‚Äô Kalau nggak berubah, pakai earphone atau fokus ke kerjaanmu. Tulis tiga hal seru di kantor, seperti proyek baru. Kalau masih susah, tahan diri dengan tarik napas dalam. Coba bawa earphone besok.;0.9283;0.218;0.4405;0.4878
FILOSOFI-TERAS-HENRY-MANAMPIRING-191-227;grok;Aku capek ngadepin temen yang selalu drama di medsos. Gimana caranya biar nggak habis energi?;Drama di medsos bisa bikin lelah. Tanyain diri: ‚ÄòWorth it nggak habisin waktu buat ini?‚Äô Tulis tiga hal yang bikin kamu bahagia, seperti hobi atau keluarga. Kurangin scroll medsos atau mute temen itu. Fokus ke orang yang bikin kamu semangat, atau nikmati waktu offline dengan jalan kaki. Waktumu berharga, lho. Coba lakuin satu aktivitas offline seru besok.;0.8544;0.1773;0.5475;0.3069
FILOSOFI-TERAS-HENRY-MANAMPIRING-191-227;grok;Aku takut jujur ke temen soal kesalahan bareng, takut dia kesel. Gimana caranya biar berani?;Takut jujur emang bikin grogi, tapi coba tanya: ‚ÄòLebih tenang nggak kalau aku jujur?‚Äô Tulis tiga alasan kenapa jujur penting, seperti bikin hati lega. Mulai dengan ngomong santai, seperti, ‚ÄòAku mau cerita soal ini, boleh?‚Äô Bayangin dia dengerin dengan baik, rasanya ringan, kan? Jujur bikin kamu lebih tenang. Coba tulis apa yang mau kamu bilang ke temen malam ini.;0.951;0.1402;0.2457;0.7053
FILOSOFI-TERAS-HENRY-MANAMPIRING-191-227;grok;Aku ngerasa temenku cuma deket kalau aku punya duit. Gimana caranya biar nggak stuck di pertemanan ini?;Temen yang cuma deket pas ada duit bisa bikin capek. Tanyain diri: ‚ÄòBikin aku bahagia nggak pertemanan ini?‚Äô Tulis tiga hal yang bikin kamu merasa berharga, seperti kebaikanmu. Kurangin kontak pelan-pelan, seperti tolak ajakan atau fokus ke temen lain yang tulus. Cari komunitas baru, seperti grup volunteering, buat ketemu orang positif. Kamu layak punya temen yang beneran care. Coba hubungi temen lain yang suportif besok.;0.9214;0.198;0.5385;0.3829
FILOSOFI-TERAS-HENRY-MANAMPIRING-191-227;grok;Aku gampang marah kalau diklakson di jalan. Gimana caranya biar nggak naik darah?;Diklakson bisa bikin panas, tapi coba stop dulu. Hitung sampai sepuluh, lalu tanya: ‚ÄòBikin aku lebih cepet nggak kalau marah?‚Äô Fakta cuma diklakson, bukan serangan pribadi. Putar lagu favorit atau fokus ke nyetir aman. Tulis tiga hal yang bikin kamu tenang, seperti rencana hari ini. Marah cuma bikin capek diri sendiri. Coba siapin playlist santai buat di jalan besok.;0.7813;0.2565;0.4555;0.3257
FILOSOFI-TERAS-HENRY-MANAMPIRING-191-227;grok;Aku sakit hati gara-gara dikira nggak pinter di kelas. Gimana caranya biar nggak baper?;Dikira nggak pinter bisa bikin nggak enak, tapi coba tanya: ‚ÄòBener nggak aku nggak pinter cuma karena kata orang?‚Äô Tulis tiga hal yang bikin kamu bangga, seperti usaha atau kebaikanmu. Abaikan omongan itu atau balas dengan senyum, fokus ke temen yang ngerti kamu. Kamu lebih berharga dari kata-kata mereka. Coba pelajari satu topik dengan pede besok.;0.9053;0.2412;0.3473;0.558
FILOSOFI-TERAS-HENRY-MANAMPIRING-191-227;grok;Aku jengkel sama penjaga toko yang judes. Gimana caranya biar nggak kesel?;Penjaga judes bisa bikin bete, tapi coba balas dengan sopan. Tanyain diri: ‚ÄòKalau aku ramah, apa dia bakal lanjut judes?‚Äô Tulis tiga hal yang bikin kamu tenang, seperti belanjaan yang udah beres. Ucapin ‚Äòterima kasih‚Äô dengan senyum, atau fokus ke hal lain yang bikin senang. Keramahan itu kekuatan. Coba balas judes dengan sopan di toko besok, lihat reaksinya.;0.9053;0.2985;0.3455;0.5598
FILOSOFI-TERAS-HENRY-MANAMPIRING-191-227;grok;Aku marah sama kolega yang nyebar rumor. Gimana caranya biar nggak emosi?;Rumor bisa bikin sakit hati, tapi coba tanya: ‚ÄòDia sengaja nggak ya?‚Äô Mungkin dia nggak sadar itu menyakitimu. Tarik napas dalam, lalu ajak ngobrol santai, seperti, ‚ÄòAku denger ada rumor, bener nggak?‚Äô Tulis tiga hal yang bikin kamu bersyukur, seperti kolega lain yang suportif. Fokus ke langkah kecil, seperti jaga jarak kalau perlu. Yuk, coba ngobrol sama kolega itu besok.;0.8861;0.2016;0.3755;0.5106
FILOSOFI-TERAS-HENRY-MANAMPIRING-191-227;grok;Aku gampang emosi kalau ibuku nanya soal pacar. Gimana caranya biar lebih sabar?;Pertanyaan ibu soal pacar bisa bikin kesel, tapi coba stop dulu. Tarik napas dalam, lalu tanya: ‚ÄòFakta apa? Ibu cuma nanya, bukan nyudutin.‚Äô Tulis tiga momen manis bareng ibumu, seperti masakan dia. Balas dengan santai, seperti, ‚ÄòNanti deh, Bu, lagi fokus kerja.‚Äô Fokus ke hal yang bikin senang, seperti hobi. Sabar itu kekuatan. Coba alihkan obrolan ke topik seru sama ibu besok.;0.9159;0.1727;0.3492;0.5666
FILOSOFI-TERAS-HENRY-MANAMPIRING-191-227;grok;Aku kesal sama temen yang selalu ngutang nggak balik. Gimana caranya biar nggak jengkel?;Ngutang nggak balik bisa bikin bete, tapi coba sapa dia santai: ‚ÄòEh, soal utang kemarin, bisa balik kapan?‚Äô Tanyain diri: ‚ÄòBisa nggak aku ubah kebiasaannya?‚Äô Kalau nggak berubah, tolak pinjaman berikutnya dengan sopan. Tulis tiga hal seru bareng temen itu biar nggak kesel. Kalau masih susah, tahan diri dengan tarik napas dalam. Coba ngobrol soal utang besok.;0.9033;0.1705;0.3807;0.5225
FILOSOFI-TERAS-HENRY-MANAMPIRING-191-227;grok;Aku capek ngadepin tetangga yang selalu gossip. Gimana caranya biar nggak habis energi?;Gossip tetangga bisa bikin lelah. Tanyain diri: ‚ÄòWorth it nggak habisin waktu buat ini?‚Äô Tulis tiga hal yang bikin kamu bahagia, seperti hobi atau keluarga. Kurangin ngobrol sama dia, seperti tolak ajakan ngobrol sekali-dua. Fokus ke orang yang bikin kamu semangat, atau nikmati waktu dengan jalan kaki. Waktumu berharga, lho. Coba lakuin satu aktivitas seru besok.;0.8568;0.2553;0.4596;0.3971
FILOSOFI-TERAS-HENRY-MANAMPIRING-191-227;grok;Aku takut jujur ke pacar soal kesalahan kecilku, takut dia marah. Gimana caranya biar berani?;Takut jujur ke pacar emang bikin grogi, tapi coba tanya: ‚ÄòLebih tenang nggak kalau aku jujur?‚Äô Tulis tiga alasan kenapa jujur penting, seperti bikin hati lega. Mulai dengan ngomong santai, seperti, ‚ÄòAku mau cerita soal ini, boleh?‚Äô Bayangin dia dengerin dengan baik, rasanya ringan, kan? Jujur bikin kamu lebih tenang. Coba tulis apa yang mau kamu bilang ke pacar malam ini.;0.9254;0.1328;0.2607;0.6648
FILOSOFI-TERAS-HENRY-MANAMPIRING-191-227;grok;Aku ngerasa temenku cuma deket kalau aku sukses. Gimana caranya biar nggak stuck di pertemanan ini?;Temen yang cuma deket pas sukses bisa bikin capek. Tanyain diri: ‚ÄòBikin aku bahagia nggak pertemanan ini?‚Äô Tulis tiga hal yang bikin kamu merasa berharga, seperti kebaikanmu. Kurangin kontak pelan-pelan, seperti tolak ajakan atau fokus ke temen lain yang tulus. Cari komunitas baru, seperti grup seni, buat ketemu orang positif. Kamu layak punya temen yang beneran care. Coba hubungi temen lain yang suportif besok.;0.9044;0.2102;0.518;0.3864
FILOSOFI-TERAS-HENRY-MANAMPIRING-191-227;grok;Aku gampang marah kalau diserobot di antrean. Gimana caranya biar nggak naik darah?;Diserobot di antrean bisa bikin panas, tapi coba stop dulu. Hitung sampai sepuluh, lalu tanya: ‚ÄòBikin aku lebih cepet nggak kalau marah?‚Äô Fakta cuma diserobot, bukan serangan pribadi. Sapa santai, seperti, ‚ÄòEh, antrean di belakang ya.‚Äô Tulis tiga hal yang bikin kamu tenang, seperti rencana hari ini. Marah cuma bikin capek diri sendiri. Coba sapa ramah kalau diserobot besok.;0.8972;0.2525;0.5864;0.3108
FILOSOFI-TERAS-HENRY-MANAMPIRING-191-227;grok;Aku sakit hati gara-gara dikira nggak gaul di kantor. Gimana caranya biar nggak baper?;Dikira nggak gaul bisa bikin nggak enak, tapi coba tanya: ‚ÄòBener nggak aku nggak gaul cuma karena kata orang?‚Äô Tulis tiga hal yang bikin kamu bangga, seperti kerja keras atau kebaikanmu. Abaikan omongan itu atau balas dengan senyum, fokus ke kolega yang ngerti kamu. Kamu lebih berharga dari kata-kata mereka. Coba ajak ngobrol kolega suportif besok.;0.9503;0.2496;0.3075;0.6429
FILOSOFI-TERAS-HENRY-MANAMPIRING-191-227;grok;Aku jengkel sama pelayan restoran yang judes. Gimana caranya biar nggak kesel?;Pelayan judes bisa bikin bete, tapi coba balas dengan sopan. Tanyain diri: ‚ÄòKalau aku ramah, apa dia bakal lanjut judes?‚Äô Tulis tiga hal yang bikin kamu tenang, seperti makanan enak. Ucapin ‚Äòterima kasih‚Äô dengan senyum, atau fokus ke hal lain yang bikin senang. Keramahan itu kekuatan. Coba balas judes dengan sopan di restoran besok, lihat reaksinya.;0.9069;0.3547;0.3044;0.6026
FILOSOFI-TERAS-HENRY-MANAMPIRING-191-227;grok;Aku marah sama temen yang lupa ulang tahunku. Gimana caranya biar nggak emosi?;Lupa ulang tahun bisa bikin sakit hati, tapi coba tanya: ‚ÄòDia sengaja nggak ya?‚Äô Mungkin dia nggak sadar itu penting. Tarik napas dalam, lalu ajak ngobrol santai, seperti, ‚ÄòEh, kemarin ultahku, lho.‚Äô Tulis tiga hal yang bikin kamu bersyukur, seperti temen lain yang ingat. Fokus ke langkah kecil, seperti rayain ultah dengan cara seru. Yuk, coba ngobrol sama temen itu besok.;0.8945;0.1848;0.4369;0.4576
FILOSOFI-TERAS-HENRY-MANAMPIRING-191-227;grok;Aku gampang emosi kalau temenku lupa janjian. Gimana caranya biar lebih sabar?;Temen lupa janjian bisa bikin kesel, tapi coba stop dulu. Tarik napas dalam, lalu tanya: ‚ÄòFakta apa? Dia lupa, bukan benci aku.‚Äô Tulis tiga momen seru bareng temenmu, seperti nongkrong terakhir. Kirim pesan santai, seperti, ‚ÄòEh, kapan kita ketemu lagi?‚Äô Fokus ke hal yang bikin senang, seperti hobi. Sabar itu kekuatan. Coba kirim pesan ramah ke temen besok.;0.8793;0.1912;0.5358;0.3435
FILOSOFI-TERAS-HENRY-MANAMPIRING-191-227;grok;Aku kesal sama tetangga yang selalu parkir sembarangan. Gimana caranya biar nggak jengkel?;Parkir sembarangan bisa bikin bete, tapi coba sapa dia santai: ‚ÄòEh, parkirnya mungkin bisa diatur biar rapi ya.‚Äô Tanyain diri: ‚ÄòBisa nggak aku ubah kebiasaannya?‚Äô Kalau nggak berubah, fokus ke hal lain, seperti nikmati waktu di rumah. Tulis tiga hal seru di lingkunganmu, seperti tetangga lain yang ramah. Kalau masih susah, tahan diri dengan tarik napas dalam. Coba ngobrol soal parkir besok.;0.8959;0.2041;0.4239;0.4721
FILOSOFI-TERAS-HENRY-MANAMPIRING-191-227;grok;Aku capek ngadepin kolega yang selalu nyinyir. Gimana caranya biar nggak habis energi?;Nyinyiran kolega bisa bikin lelah. Tanyain diri: ‚ÄòWorth it nggak habisin waktu buat ini?‚Äô Tulis tiga hal yang bikin kamu bahagia, seperti proyek atau temen lain. Kurangin ngobrol sama dia, seperti fokus ke kerjaanmu. Cari kolega yang bikin semangat, atau nikmati waktu dengan hobi. Waktumu berharga, lho. Coba ajak ngobrol kolega suportif besok.;0.9059;0.2319;0.339;0.5668
FILOSOFI-TERAS-HENRY-MANAMPIRING-191-227;grok;Aku takut jujur ke keluarga soal kegagalanku, takut mereka kecewa. Gimana caranya biar berani?;Takut jujur ke keluarga emang bikin grogi, tapi coba tanya: ‚ÄòLebih tenang nggak kalau aku jujur?‚Äô Tulis tiga alasan kenapa jujur penting, seperti bikin hati lega. Mulai dengan ngomong santai, seperti, ‚ÄòAku mau cerita soal ini, boleh?‚Äô Bayangin mereka dengerin dengan baik, rasanya ringan, kan? Jujur bikin kamu lebih tenang. Coba tulis apa yang mau kamu bilang ke keluarga malam ini.;0.9476;0.1165;0.2167;0.7309
FILOSOFI-TERAS-HENRY-MANAMPIRING-191-227;grok;Aku ngerasa temenku cuma deket kalau aku punya waktu luang. Gimana caranya biar nggak stuck di pertemanan ini?;Temen yang cuma deket pas ada waktu bisa bikin capek. Tanyain diri: ‚ÄòBikin aku bahagia nggak pertemanan ini?‚Äô Tulis tiga hal yang bikin kamu merasa berharga, seperti kebaikanmu. Kurangin kontak pelan-pelan, seperti tolak ajakan atau fokus ke temen lain yang tulus. Cari komunitas baru, seperti grup musik, buat ketemu orang positif. Kamu layak punya temen yang beneran care. Coba hubungi temen lain yang suportif besok.;0.8684;0.1958;0.4556;0.4128
FILOSOFI-TERAS-HENRY-MANAMPIRING-191-227;grok;Aku gampang marah kalau diserobot di jalan. Gimana caranya biar nggak naik darah?;Diserobot di jalan bisa bikin panas, tapi coba stop dulu. Hitung sampai sepuluh, lalu tanya: ‚ÄòBikin aku lebih cepet nggak kalau marah?‚Äô Fakta cuma diserobot, bukan serangan pribadi. Putar lagu favorit atau fokus ke nyetir aman. Tulis tiga hal yang bikin kamu tenang, seperti rencana hari ini. Marah cuma bikin capek diri sendiri. Coba siapin playlist santai buat di jalan besok.;0.8499;0.2372;0.4276;0.4223
FILOSOFI-TERAS-HENRY-MANAMPIRING-191-227;grok;Aku sakit hati gara-gara dikira nggak kompeten di kantor. Gimana caranya biar nggak baper?;Dikira nggak kompeten bisa bikin nggak enak, tapi coba tanya: ‚ÄòBener nggak aku nggak kompeten cuma karena kata orang?‚Äô Tulis tiga hal yang bikin kamu bangga, seperti proyek atau kebaikanmu. Abaikan omongan itu atau balas dengan senyum, fokus ke kolega yang ngerti kamu. Kamu lebih berharga dari kata-kata mereka. Coba selesaikan satu tugas dengan pede besok.;0.9403;0.2964;0.3588;0.5815
FILOSOFI-TERAS-HENRY-MANAMPIRING-191-227;grok;Aku jengkel sama tetangga yang selalu nyanyi keras malam hari. Gimana caranya biar nggak kesel?;Nyanyi keras malam hari bisa bikin bete, tapi coba balas dengan sopan. Tanyain diri: ‚ÄòKalau aku ramah, apa dia bakal lanjut keras?‚Äô Tulis tiga hal yang bikin kamu tenang, seperti tidur nyenyak. Sapa santai, seperti, ‚ÄòLagu bagus, tapi mungkin pelan dikit ya malam.‚Äô Fokus ke hal lain yang bikin senang, seperti baca buku. Keramahan itu kekuatan. Coba sapa tetangga itu besok.;0.8841;0.1796;0.4586;0.4256
FILOSOFI-TERAS-HENRY-MANAMPIRING-191-227;grok;Aku marah sama temen yang lupa bayar utang. Gimana caranya biar nggak emosi?;Lupa bayar utang bisa bikin sakit hati, tapi coba tanya: ‚ÄòDia sengaja nggak ya?‚Äô Mungkin dia nggak sadar itu penting. Tarik napas dalam, lalu ajak ngobrol santai, seperti, ‚ÄòEh, soal utang kemarin, kapan bisa balik?‚Äô Tulis tiga hal yang bikin kamu bersyukur, seperti temen lain yang suportif. Fokus ke langkah kecil, seperti buat batasan. Yuk, coba ngobrol sama temen itu besok.;0.8662;0.1775;0.5047;0.3614
FILOSOFI-TERAS-HENRY-MANAMPIRING-191-227;grok;Aku gampang emosi kalau saudara nanya soal kerjaanku. Gimana caranya biar lebih sabar?;Pertanyaan saudara soal kerja bisa bikin kesel, tapi coba stop dulu. Tarik napas dalam, lalu tanya: ‚ÄòFakta apa? Mereka cuma nanya, bukan nyudutin.‚Äô Tulis tiga momen manis bareng saudaramu, seperti ngobrol seru. Balas dengan santai, seperti, ‚ÄòLagi asik, nanti cerita deh.‚Äô Fokus ke hal yang bikin senang, seperti hobi. Sabar itu kekuatan. Coba alihkan obrolan ke topik seru sama saudara besok.;0.904;0.163;0.4127;0.4914
FILOSOFI-TERAS-HENRY-MANAMPIRING-191-227;grok;Aku kesal sama temen yang selalu nyanyi keras di kosan. Gimana caranya biar nggak jengkel?;Nyanyi keras di kosan bisa bikin bete, tapi coba sapa dia santai: ‚ÄòEh, lagunya oke, tapi mungkin pelan dikit ya.‚Äô Tanyain diri: ‚ÄòBisa nggak aku ubah kebiasaannya?‚Äô Kalau nggak berubah, pakai earphone atau fokus ke hobimu. Tulis tiga hal seru di kosan, seperti temen lain yang asik. Kalau masih susah, tahan diri dengan tarik napas dalam. Coba bawa earphone besok.;0.8901;0.218;0.402;0.4881
